Running as user "root" and group "root". This could be dangerous.
Capturing on 'tun144'
    1 0.000000000 169.254.144.9 → 169.254.145.9 TCP 40 36213 → 23317 [SYN] Seq=0 Win=0 Len=0
    2 0.000604557 169.254.145.9 → 169.254.144.9 TCP 40 23317 → 36213 [SYN, ACK] Seq=0 Ack=1 Win=8192 Len=0
    3 0.002136875 169.254.144.9 → 169.254.145.9 TCP 40 36213 → 23317 [ACK] Seq=1 Ack=1 Win=8192 Len=0
    4 0.003167531 169.254.144.9 → 169.254.145.9 TCP 1040 36213 → 23317 [ACK] Seq=1 Ack=1 Win=8192 Len=1000
    5 0.003269220 169.254.144.9 → 169.254.145.9 TCP 1040 36213 → 23317 [ACK] Seq=1001 Ack=1 Win=8192 Len=1000
    6 0.003273989 169.254.144.9 → 169.254.145.9 TCP 1040 36213 → 23317 [ACK] Seq=2001 Ack=1 Win=8192 Len=1000
    7 0.003280822 169.254.144.9 → 169.254.145.9 TCP 1040 36213 → 23317 [ACK] Seq=3001 Ack=1 Win=8192 Len=1000
    8 0.003286613 169.254.144.9 → 169.254.145.9 TCP 1040 36213 → 23317 [ACK] Seq=4001 Ack=1 Win=8192 Len=1000
    9 0.003292453 169.254.144.9 → 169.254.145.9 TCP 1040 36213 → 23317 [ACK] Seq=5001 Ack=1 Win=8192 Len=1000
   10 0.003297653 169.254.144.9 → 169.254.145.9 TCP 1040 36213 → 23317 [ACK] Seq=6001 Ack=1 Win=8192 Len=1000
   11 0.003303334 169.254.144.9 → 169.254.145.9 TCP 1040 36213 → 23317 [ACK] Seq=7001 Ack=1 Win=8192 Len=1000
   12 0.003308634 169.254.144.9 → 169.254.145.9 TCP 232 [TCP Window Full] 36213 → 23317 [ACK] Seq=8001 Ack=1 Win=8192 Len=192
   13 0.005098124 169.254.145.9 → 169.254.144.9 TCP 40 23317 → 36213 [ACK] Seq=1 Ack=1001 Win=7192 Len=0
   14 0.005111419 169.254.145.9 → 169.254.144.9 TCP 40 23317 → 36213 [ACK] Seq=1 Ack=2001 Win=6192 Len=0
   15 0.005117420 169.254.145.9 → 169.254.144.9 TCP 1040 23317 → 36213 [ACK] Seq=1 Ack=2001 Win=6192 Len=1000
   16 0.005123191 169.254.145.9 → 169.254.144.9 TCP 1040 23317 → 36213 [ACK] Seq=1001 Ack=2001 Win=6192 Len=1000
   17 0.005128531 169.254.145.9 → 169.254.144.9 TCP 1040 23317 → 36213 [ACK] Seq=2001 Ack=2001 Win=6192 Len=1000
   18 0.005134161 169.254.145.9 → 169.254.144.9 TCP 1040 23317 → 36213 [ACK] Seq=3001 Ack=2001 Win=6192 Len=1000
   19 0.005139361 169.254.145.9 → 169.254.144.9 TCP 1040 23317 → 36213 [ACK] Seq=4001 Ack=2001 Win=6192 Len=1000
   20 0.005145422 169.254.145.9 → 169.254.144.9 TCP 1040 23317 → 36213 [ACK] Seq=5001 Ack=2001 Win=6192 Len=1000
   21 0.005151303 169.254.145.9 → 169.254.144.9 TCP 1040 23317 → 36213 [ACK] Seq=6001 Ack=2001 Win=6192 Len=1000
   22 0.005156533 169.254.145.9 → 169.254.144.9 TCP 1040 23317 → 36213 [ACK] Seq=7001 Ack=2001 Win=6192 Len=1000
   23 0.005161432 169.254.145.9 → 169.254.144.9 TCP 232 [TCP Window Full] 23317 → 36213 [ACK] Seq=8001 Ack=2001 Win=6192 Len=192
   24 0.005917462 169.254.145.9 → 169.254.144.9 TCP 40 23317 → 36213 [ACK] Seq=8193 Ack=3001 Win=7192 Len=0
   25 0.005926208 169.254.145.9 → 169.254.144.9 TCP 40 23317 → 36213 [ACK] Seq=8193 Ack=4001 Win=6192 Len=0
   26 0.006032977 169.254.144.9 → 169.254.145.9 TCP 40 36213 → 23317 [ACK] Seq=8193 Ack=1001 Win=7192 Len=0
   27 0.006048526 169.254.145.9 → 169.254.144.9 TCP 40 23317 → 36213 [ACK] Seq=8193 Ack=5001 Win=7192 Len=0
   28 0.006054597 169.254.145.9 → 169.254.144.9 TCP 40 23317 → 36213 [ACK] Seq=8193 Ack=6001 Win=6192 Len=0
   29 0.006059587 169.254.144.9 → 169.254.145.9 TCP 40 36213 → 23317 [ACK] Seq=8193 Ack=2001 Win=6192 Len=0
   30 0.006114639 169.254.145.9 → 169.254.144.9 TCP 40 23317 → 36213 [ACK] Seq=8193 Ack=7001 Win=7192 Len=0
   31 0.006119388 169.254.145.9 → 169.254.144.9 TCP 40 23317 → 36213 [ACK] Seq=8193 Ack=8001 Win=6192 Len=0
   32 0.006125330 169.254.144.9 → 169.254.145.9 TCP 40 36213 → 23317 [ACK] Seq=8193 Ack=3001 Win=7192 Len=0
   33 0.006130509 169.254.144.9 → 169.254.145.9 TCP 40 36213 → 23317 [ACK] Seq=8193 Ack=4001 Win=6192 Len=0
   34 0.006175703 169.254.145.9 → 169.254.144.9 TCP 40 23317 → 36213 [ACK] Seq=8193 Ack=8193 Win=8000 Len=0
   35 0.006186343 169.254.144.9 → 169.254.145.9 TCP 40 36213 → 23317 [ACK] Seq=8193 Ack=5001 Win=7192 Len=0
   36 0.006191222 169.254.144.9 → 169.254.145.9 TCP 40 36213 → 23317 [ACK] Seq=8193 Ack=6001 Win=6192 Len=0
   37 0.006270219 169.254.145.9 → 169.254.144.9 TCP 1040 23317 → 36213 [ACK] Seq=8193 Ack=8193 Win=8192 Len=1000
   38 0.006273446 169.254.144.9 → 169.254.145.9 TCP 40 36213 → 23317 [ACK] Seq=8193 Ack=7001 Win=7192 Len=0
   39 0.006276821 169.254.145.9 → 169.254.144.9 TCP 1040 23317 → 36213 [ACK] Seq=9193 Ack=8193 Win=8192 Len=1000
   40 0.006278716 169.254.144.9 → 169.254.145.9 TCP 40 36213 → 23317 [ACK] Seq=8193 Ack=8001 Win=6192 Len=0
   41 0.006327607 169.254.144.9 → 169.254.145.9 TCP 40 36213 → 23317 [ACK] Seq=8193 Ack=8193 Win=8000 Len=0
   42 0.006333558 169.254.144.9 → 169.254.145.9 TCP 1040 36213 → 23317 [ACK] Seq=8193 Ack=8193 Win=8000 Len=1000
   43 0.006334509 169.254.145.9 → 169.254.144.9 TCP 1040 23317 → 36213 [ACK] Seq=10193 Ack=8193 Win=8192 Len=1000
   44 0.006338417 169.254.144.9 → 169.254.145.9 TCP 1040 36213 → 23317 [ACK] Seq=9193 Ack=8193 Win=8000 Len=1000
   45 0.006340160 169.254.145.9 → 169.254.144.9 TCP 1040 23317 → 36213 [ACK] Seq=11193 Ack=8193 Win=8192 Len=1000
   46 0.006396204 169.254.145.9 → 169.254.144.9 TCP 1040 23317 → 36213 [ACK] Seq=12193 Ack=8193 Win=8192 Len=1000
   47 0.006401855 169.254.145.9 → 169.254.144.9 TCP 1040 23317 → 36213 [ACK] Seq=13193 Ack=8193 Win=8192 Len=1000
   48 0.006422864 169.254.144.9 → 169.254.145.9 TCP 1040 36213 → 23317 [ACK] Seq=10193 Ack=8193 Win=8192 Len=1000
   49 0.006429597 169.254.144.9 → 169.254.145.9 TCP 1040 36213 → 23317 [ACK] Seq=11193 Ack=8193 Win=8192 Len=1000
   50 0.006476033 169.254.145.9 → 169.254.144.9 TCP 1040 23317 → 36213 [ACK] Seq=14193 Ack=8193 Win=8192 Len=1000
   51 0.006481303 169.254.145.9 → 169.254.144.9 TCP 1040 23317 → 36213 [ACK] Seq=15193 Ack=8193 Win=8192 Len=1000
   52 0.006484970 169.254.144.9 → 169.254.145.9 TCP 1040 36213 → 23317 [ACK] Seq=12193 Ack=8193 Win=8192 Len=1000
   53 0.006485430 169.254.145.9 → 169.254.144.9 TCP 40 23317 → 36213 [ACK] Seq=16193 Ack=9193 Win=7192 Len=0
   54 0.006491863 169.254.144.9 → 169.254.145.9 TCP 1040 36213 → 23317 [ACK] Seq=13193 Ack=8193 Win=8192 Len=1000
   55 0.006550281 169.254.145.9 → 169.254.144.9 TCP 40 23317 → 36213 [ACK] Seq=16193 Ack=10193 Win=6192 Len=0
   56 0.006551324 169.254.144.9 → 169.254.145.9 TCP 1040 36213 → 23317 [ACK] Seq=14193 Ack=8193 Win=8192 Len=1000
   57 0.006554689 169.254.145.9 → 169.254.144.9 TCP 232 [TCP Window Full] 23317 → 36213 [ACK] Seq=16193 Ack=11193 Win=7192 Len=192
   58 0.006557215 169.254.144.9 → 169.254.145.9 TCP 1040 36213 → 23317 [ACK] Seq=15193 Ack=8193 Win=8192 Len=1000
   59 0.006562535 169.254.144.9 → 169.254.145.9 TCP 232 36213 → 23317 [ACK] Seq=16193 Ack=9193 Win=7192 Len=192
   60 0.006620141 169.254.145.9 → 169.254.144.9 TCP 40 23317 → 36213 [ACK] Seq=16385 Ack=12193 Win=6192 Len=0
   61 0.006629048 169.254.145.9 → 169.254.144.9 TCP 40 23317 → 36213 [ACK] Seq=16385 Ack=13193 Win=7192 Len=0
   62 0.006698317 169.254.145.9 → 169.254.144.9 TCP 40 23317 → 36213 [ACK] Seq=16385 Ack=14193 Win=6192 Len=0
   63 0.006702475 169.254.145.9 → 169.254.144.9 TCP 40 23317 → 36213 [ACK] Seq=16385 Ack=15193 Win=7192 Len=0
   64 0.006746648 169.254.144.9 → 169.254.145.9 TCP 40 36213 → 23317 [ACK] Seq=16385 Ack=10193 Win=6192 Len=0
   65 0.006757197 169.254.145.9 → 169.254.144.9 TCP 40 23317 → 36213 [ACK] Seq=16385 Ack=16193 Win=6192 Len=0
   66 0.006761144 169.254.145.9 → 169.254.144.9 TCP 40 23317 → 36213 [ACK] Seq=16385 Ack=16385 Win=8000 Len=0
   67 0.006770683 169.254.144.9 → 169.254.145.9 TCP 40 36213 → 23317 [ACK] Seq=16385 Ack=11193 Win=7192 Len=0
   68 0.006832167 169.254.144.9 → 169.254.145.9 TCP 40 36213 → 23317 [ACK] Seq=16385 Ack=12193 Win=6192 Len=0
   69 0.006838148 169.254.144.9 → 169.254.145.9 TCP 40 36213 → 23317 [ACK] Seq=16385 Ack=13193 Win=7192 Len=0
   70 0.006906235 169.254.144.9 → 169.254.145.9 TCP 40 36213 → 23317 [ACK] Seq=16385 Ack=14193 Win=6192 Len=0
   71 0.006911205 169.254.144.9 → 169.254.145.9 TCP 40 36213 → 23317 [ACK] Seq=16385 Ack=15193 Win=7192 Len=0
   72 0.006997065 169.254.144.9 → 169.254.145.9 TCP 40 36213 → 23317 [ACK] Seq=16385 Ack=16193 Win=6192 Len=0
   73 0.007152174 169.254.144.9 → 169.254.145.9 TCP 1040 36213 → 23317 [ACK] Seq=16385 Ack=16385 Win=8000 Len=1000
   74 0.007161902 169.254.144.9 → 169.254.145.9 TCP 1040 36213 → 23317 [ACK] Seq=17385 Ack=16385 Win=8000 Len=1000
   75 0.007209020 169.254.144.9 → 169.254.145.9 TCP 1040 36213 → 23317 [ACK] Seq=18385 Ack=16385 Win=8192 Len=1000
   76 0.007214219 169.254.144.9 → 169.254.145.9 TCP 1040 36213 → 23317 [ACK] Seq=19385 Ack=16385 Win=8192 Len=1000
   77 0.007249435 169.254.144.9 → 169.254.145.9 TCP 1040 36213 → 23317 [ACK] Seq=20385 Ack=16385 Win=8192 Len=1000
   78 0.007256558 169.254.144.9 → 169.254.145.9 TCP 1040 36213 → 23317 [ACK] Seq=21385 Ack=16385 Win=8192 Len=1000
   79 0.007281314 169.254.144.9 → 169.254.145.9 TCP 1040 36213 → 23317 [ACK] Seq=22385 Ack=16385 Win=8192 Len=1000
   80 0.007286594 169.254.144.9 → 169.254.145.9 TCP 1040 [TCP Window Full] 36213 → 23317 [ACK] Seq=23385 Ack=16385 Win=8192 Len=1000
   81 0.007529867 169.254.145.9 → 169.254.144.9 TCP 1040 23317 → 36213 [ACK] Seq=16385 Ack=16385 Win=8192 Len=1000
   82 0.007552650 169.254.145.9 → 169.254.144.9 TCP 1040 23317 → 36213 [ACK] Seq=17385 Ack=16385 Win=8192 Len=1000
   83 0.007599487 169.254.145.9 → 169.254.144.9 TCP 1040 23317 → 36213 [ACK] Seq=18385 Ack=16385 Win=8192 Len=1000
   84 0.007604086 169.254.145.9 → 169.254.144.9 TCP 1040 23317 → 36213 [ACK] Seq=19385 Ack=16385 Win=8192 Len=1000
   85 0.007640363 169.254.145.9 → 169.254.144.9 TCP 1040 23317 → 36213 [ACK] Seq=20385 Ack=16385 Win=8192 Len=1000
   86 0.007645292 169.254.145.9 → 169.254.144.9 TCP 1040 23317 → 36213 [ACK] Seq=21385 Ack=16385 Win=8192 Len=1000
   87 0.007706947 169.254.145.9 → 169.254.144.9 TCP 1040 23317 → 36213 [ACK] Seq=22385 Ack=17385 Win=7192 Len=1000
   88 0.007711616 169.254.145.9 → 169.254.144.9 TCP 1040 23317 → 36213 [ACK] Seq=23385 Ack=17385 Win=7192 Len=1000
   89 0.007716124 169.254.145.9 → 169.254.144.9 TCP 40 23317 → 36213 [ACK] Seq=24385 Ack=18385 Win=6192 Len=0
   90 0.007762461 169.254.145.9 → 169.254.144.9 TCP 232 [TCP Window Full] 23317 → 36213 [ACK] Seq=24385 Ack=19385 Win=7192 Len=192
   91 0.007767119 169.254.145.9 → 169.254.144.9 TCP 40 23317 → 36213 [ACK] Seq=24577 Ack=20385 Win=6192 Len=0
   92 0.007808797 169.254.145.9 → 169.254.144.9 TCP 40 23317 → 36213 [ACK] Seq=24577 Ack=21385 Win=7192 Len=0
   93 0.007814177 169.254.145.9 → 169.254.144.9 TCP 40 23317 → 36213 [ACK] Seq=24577 Ack=22385 Win=6192 Len=0
   94 0.007855655 169.254.145.9 → 169.254.144.9 TCP 40 23317 → 36213 [ACK] Seq=24577 Ack=23385 Win=7192 Len=0
   95 0.007859301 169.254.145.9 → 169.254.144.9 TCP 40 23317 → 36213 [ACK] Seq=24577 Ack=24385 Win=6192 Len=0
   96 0.008266352 169.254.144.9 → 169.254.145.9 TCP 232 36213 → 23317 [ACK] Seq=24385 Ack=17385 Win=7192 Len=192
   97 0.008302750 169.254.144.9 → 169.254.145.9 TCP 40 36213 → 23317 [ACK] Seq=24577 Ack=18385 Win=6192 Len=0
   98 0.008346983 169.254.144.9 → 169.254.145.9 TCP 40 36213 → 23317 [ACK] Seq=24577 Ack=19385 Win=7192 Len=0
   99 0.008351251 169.254.144.9 → 169.254.145.9 TCP 40 36213 → 23317 [ACK] Seq=24577 Ack=20385 Win=6192 Len=0
  100 0.008390564 169.254.144.9 → 169.254.145.9 TCP 40 36213 → 23317 [ACK] Seq=24577 Ack=21385 Win=7192 Len=0
  101 0.008394631 169.254.144.9 → 169.254.145.9 TCP 40 36213 → 23317 [ACK] Seq=24577 Ack=22385 Win=6192 Len=0
  102 0.008434676 169.254.144.9 → 169.254.145.9 TCP 40 36213 → 23317 [ACK] Seq=24577 Ack=23385 Win=7192 Len=0
  103 0.008438684 169.254.144.9 → 169.254.145.9 TCP 40 36213 → 23317 [ACK] Seq=24577 Ack=24385 Win=6192 Len=0
  104 0.008504106 169.254.144.9 → 169.254.145.9 TCP 1040 36213 → 23317 [ACK] Seq=24577 Ack=24577 Win=8000 Len=1000
  105 0.008509987 169.254.144.9 → 169.254.145.9 TCP 1040 36213 → 23317 [ACK] Seq=25577 Ack=24577 Win=8000 Len=1000
  106 0.008546164 169.254.144.9 → 169.254.145.9 TCP 1040 36213 → 23317 [ACK] Seq=26577 Ack=24577 Win=8192 Len=1000
  107 0.008551223 169.254.144.9 → 169.254.145.9 TCP 1040 36213 → 23317 [ACK] Seq=27577 Ack=24577 Win=8192 Len=1000
  108 0.008585861 169.254.145.9 → 169.254.144.9 TCP 40 23317 → 36213 [ACK] Seq=24577 Ack=24577 Win=8000 Len=0
  109 0.008591308 169.254.144.9 → 169.254.145.9 TCP 1040 36213 → 23317 [ACK] Seq=28577 Ack=24577 Win=8192 Len=1000
  110 0.008597139 169.254.144.9 → 169.254.145.9 TCP 1040 36213 → 23317 [ACK] Seq=29577 Ack=24577 Win=8192 Len=1000
  111 0.008620703 169.254.144.9 → 169.254.145.9 TCP 1040 36213 → 23317 [ACK] Seq=30577 Ack=24577 Win=8192 Len=1000
  112 0.008626844 169.254.144.9 → 169.254.145.9 TCP 1040 [TCP Window Full] 36213 → 23317 [ACK] Seq=31577 Ack=24577 Win=8192 Len=1000
  113 0.008648307 169.254.145.9 → 169.254.144.9 TCP 1040 23317 → 36213 [ACK] Seq=24577 Ack=24577 Win=8192 Len=1000
  114 0.008656412 169.254.145.9 → 169.254.144.9 TCP 1040 23317 → 36213 [ACK] Seq=25577 Ack=24577 Win=8192 Len=1000
  115 0.008693882 169.254.145.9 → 169.254.144.9 TCP 1040 23317 → 36213 [ACK] Seq=26577 Ack=24577 Win=8192 Len=1000
  116 0.008698932 169.254.145.9 → 169.254.144.9 TCP 1040 23317 → 36213 [ACK] Seq=27577 Ack=24577 Win=8192 Len=1000
  117 0.008734698 169.254.145.9 → 169.254.144.9 TCP 1040 23317 → 36213 [ACK] Seq=28577 Ack=24577 Win=8192 Len=1000
  118 0.008739908 169.254.145.9 → 169.254.144.9 TCP 1040 23317 → 36213 [ACK] Seq=29577 Ack=24577 Win=8192 Len=1000
  119 0.008791284 169.254.145.9 → 169.254.144.9 TCP 1040 23317 → 36213 [ACK] Seq=30577 Ack=25577 Win=7192 Len=1000
  120 0.008796253 169.254.145.9 → 169.254.144.9 TCP 1040 23317 → 36213 [ACK] Seq=31577 Ack=25577 Win=7192 Len=1000
  121 0.008800371 169.254.145.9 → 169.254.144.9 TCP 40 23317 → 36213 [ACK] Seq=32577 Ack=26577 Win=6192 Len=0
  122 0.008863358 169.254.145.9 → 169.254.144.9 TCP 232 [TCP Window Full] 23317 → 36213 [ACK] Seq=32577 Ack=27577 Win=7192 Len=192
  123 0.008867075 169.254.145.9 → 169.254.144.9 TCP 40 23317 → 36213 [ACK] Seq=32769 Ack=28577 Win=6192 Len=0
  124 0.008907550 169.254.145.9 → 169.254.144.9 TCP 40 23317 → 36213 [ACK] Seq=32769 Ack=29577 Win=7192 Len=0
  125 0.008911177 169.254.145.9 → 169.254.144.9 TCP 40 23317 → 36213 [ACK] Seq=32769 Ack=30577 Win=6192 Len=0
  126 0.008954708 169.254.145.9 → 169.254.144.9 TCP 40 23317 → 36213 [ACK] Seq=32769 Ack=31577 Win=7192 Len=0
  127 0.008986868 169.254.145.9 → 169.254.144.9 TCP 40 23317 → 36213 [ACK] Seq=32769 Ack=32577 Win=6192 Len=0
  128 0.009009917 169.254.144.9 → 169.254.145.9 TCP 232 36213 → 23317 [ACK] Seq=32577 Ack=25577 Win=7192 Len=192
  129 0.009030996 169.254.144.9 → 169.254.145.9 TCP 40 36213 → 23317 [ACK] Seq=32769 Ack=26577 Win=6192 Len=0
  130 0.009113941 169.254.144.9 → 169.254.145.9 TCP 40 36213 → 23317 [ACK] Seq=32769 Ack=27577 Win=7192 Len=0
  131 0.009118820 169.254.144.9 → 169.254.145.9 TCP 40 36213 → 23317 [ACK] Seq=32769 Ack=28577 Win=6192 Len=0
  132 0.009157973 169.254.144.9 → 169.254.145.9 TCP 40 36213 → 23317 [ACK] Seq=32769 Ack=29577 Win=7192 Len=0
  133 0.009162261 169.254.144.9 → 169.254.145.9 TCP 40 36213 → 23317 [ACK] Seq=32769 Ack=30577 Win=6192 Len=0
  134 0.009206333 169.254.144.9 → 169.254.145.9 TCP 40 36213 → 23317 [ACK] Seq=32769 Ack=31577 Win=7192 Len=0
  135 0.009210441 169.254.144.9 → 169.254.145.9 TCP 40 36213 → 23317 [ACK] Seq=32769 Ack=32577 Win=6192 Len=0
  136 0.009267557 169.254.144.9 → 169.254.145.9 TCP 1040 36213 → 23317 [ACK] Seq=32769 Ack=32769 Win=8000 Len=1000
  137 0.009274129 169.254.144.9 → 169.254.145.9 TCP 1040 36213 → 23317 [ACK] Seq=33769 Ack=32769 Win=8000 Len=1000
  138 0.009314685 169.254.144.9 → 169.254.145.9 TCP 1040 36213 → 23317 [ACK] Seq=34769 Ack=32769 Win=8192 Len=1000
  139 0.009320576 169.254.144.9 → 169.254.145.9 TCP 1040 36213 → 23317 [ACK] Seq=35769 Ack=32769 Win=8192 Len=1000
  140 0.009366041 169.254.144.9 → 169.254.145.9 TCP 1040 36213 → 23317 [ACK] Seq=36769 Ack=32769 Win=8192 Len=1000
  141 0.009371962 169.254.144.9 → 169.254.145.9 TCP 1040 [TCP Window Full] 36213 → 23317 [ACK] Seq=37769 Ack=32769 Win=8192 Len=1000
  142 0.009468656 169.254.145.9 → 169.254.144.9 TCP 40 23317 → 36213 [ACK] Seq=32769 Ack=32769 Win=8000 Len=0
  143 0.009607996 169.254.145.9 → 169.254.144.9 TCP 1040 23317 → 36213 [ACK] Seq=32769 Ack=32769 Win=8192 Len=1000
  144 0.009614158 169.254.145.9 → 169.254.144.9 TCP 1040 23317 → 36213 [ACK] Seq=33769 Ack=32769 Win=8192 Len=1000
  145 0.009639040 169.254.144.9 → 169.254.145.9 TCP 1040 36213 → 23317 [ACK] Seq=38769 Ack=32769 Win=8192 Len=1000
  146 0.009648738 169.254.144.9 → 169.254.145.9 TCP 1040 36213 → 23317 [ACK] Seq=39769 Ack=32769 Win=8192 Len=1000
  147 0.009651678 169.254.145.9 → 169.254.144.9 TCP 1040 23317 → 36213 [ACK] Seq=34769 Ack=32769 Win=8192 Len=1000
  148 0.009652575 169.254.144.9 → 169.254.145.9 TCP 232 [TCP Window Full] 36213 → 23317 [ACK] Seq=40769 Ack=33769 Win=7192 Len=192
  149 0.009656266 169.254.145.9 → 169.254.144.9 TCP 1040 23317 → 36213 [ACK] Seq=35769 Ack=32769 Win=8192 Len=1000
  150 0.009695555 169.254.144.9 → 169.254.145.9 TCP 40 36213 → 23317 [ACK] Seq=40961 Ack=34769 Win=6192 Len=0
  151 0.009697032 169.254.145.9 → 169.254.144.9 TCP 1040 23317 → 36213 [ACK] Seq=36769 Ack=32769 Win=8192 Len=1000
  152 0.009699953 169.254.144.9 → 169.254.145.9 TCP 40 36213 → 23317 [ACK] Seq=40961 Ack=35769 Win=7192 Len=0
  153 0.009702102 169.254.145.9 → 169.254.144.9 TCP 1040 23317 → 36213 [ACK] Seq=37769 Ack=32769 Win=8192 Len=1000
  154 0.009739357 169.254.144.9 → 169.254.145.9 TCP 40 36213 → 23317 [ACK] Seq=40961 Ack=36769 Win=6192 Len=0
  155 0.009743274 169.254.144.9 → 169.254.145.9 TCP 40 36213 → 23317 [ACK] Seq=40961 Ack=37769 Win=7192 Len=0
  156 0.009748418 169.254.145.9 → 169.254.144.9 TCP 1040 23317 → 36213 [ACK] Seq=38769 Ack=33769 Win=7192 Len=1000
  157 0.009753227 169.254.145.9 → 169.254.144.9 TCP 1040 23317 → 36213 [ACK] Seq=39769 Ack=33769 Win=7192 Len=1000
  158 0.009756743 169.254.145.9 → 169.254.144.9 TCP 40 23317 → 36213 [ACK] Seq=40769 Ack=34769 Win=6192 Len=0
  159 0.009781716 169.254.144.9 → 169.254.145.9 TCP 40 36213 → 23317 [ACK] Seq=40961 Ack=38769 Win=6192 Len=0
  160 0.009785723 169.254.144.9 → 169.254.145.9 TCP 40 36213 → 23317 [ACK] Seq=40961 Ack=39769 Win=7192 Len=0
  161 0.009799714 169.254.145.9 → 169.254.144.9 TCP 232 23317 → 36213 [ACK] Seq=40769 Ack=35769 Win=7192 Len=192
  162 0.009803270 169.254.145.9 → 169.254.144.9 TCP 40 23317 → 36213 [ACK] Seq=40961 Ack=36769 Win=6192 Len=0
  163 0.009824115 169.254.144.9 → 169.254.145.9 TCP 40 36213 → 23317 [ACK] Seq=40961 Ack=40769 Win=6192 Len=0
  164 0.009847623 169.254.145.9 → 169.254.144.9 TCP 40 23317 → 36213 [ACK] Seq=40961 Ack=37769 Win=7192 Len=0
  165 0.009851189 169.254.145.9 → 169.254.144.9 TCP 40 23317 → 36213 [ACK] Seq=40961 Ack=38769 Win=6192 Len=0
  166 0.009864209 169.254.144.9 → 169.254.145.9 TCP 1040 36213 → 23317 [ACK] Seq=40961 Ack=40961 Win=8000 Len=1000
  167 0.009869128 169.254.144.9 → 169.254.145.9 TCP 1040 36213 → 23317 [ACK] Seq=41961 Ack=40961 Win=8000 Len=1000
  168 0.009891064 169.254.145.9 → 169.254.144.9 TCP 40 23317 → 36213 [ACK] Seq=40961 Ack=39769 Win=7192 Len=0
  169 0.009894530 169.254.145.9 → 169.254.144.9 TCP 40 23317 → 36213 [ACK] Seq=40961 Ack=40769 Win=6192 Len=0
  170 0.009903643 169.254.144.9 → 169.254.145.9 TCP 1040 36213 → 23317 [ACK] Seq=42961 Ack=40961 Win=8192 Len=1000
  171 0.009908542 169.254.144.9 → 169.254.145.9 TCP 1040 36213 → 23317 [ACK] Seq=43961 Ack=40961 Win=8192 Len=1000
  172 0.009930798 169.254.145.9 → 169.254.144.9 TCP 40 23317 → 36213 [ACK] Seq=40961 Ack=40961 Win=8000 Len=0
  173 0.009943166 169.254.144.9 → 169.254.145.9 TCP 1040 36213 → 23317 [ACK] Seq=44961 Ack=40961 Win=8192 Len=1000
  174 0.009948116 169.254.144.9 → 169.254.145.9 TCP 1040 36213 → 23317 [ACK] Seq=45961 Ack=40961 Win=8192 Len=1000
  175 0.010003043 169.254.145.9 → 169.254.144.9 TCP 1040 23317 → 36213 [ACK] Seq=40961 Ack=40961 Win=8192 Len=1000
  176 0.010003018 169.254.144.9 → 169.254.145.9 TCP 1040 36213 → 23317 [ACK] Seq=46961 Ack=40961 Win=8192 Len=1000
  177 0.010008513 169.254.145.9 → 169.254.144.9 TCP 1040 23317 → 36213 [ACK] Seq=41961 Ack=40961 Win=8192 Len=1000
  178 0.010011103 169.254.144.9 → 169.254.145.9 TCP 1040 36213 → 23317 [ACK] Seq=47961 Ack=40961 Win=8192 Len=1000
  179 0.010053647 169.254.145.9 → 169.254.144.9 TCP 1040 23317 → 36213 [ACK] Seq=42961 Ack=40961 Win=8192 Len=1000
  180 0.010055346 169.254.144.9 → 169.254.145.9 TCP 232 [TCP Window Full] 36213 → 23317 [ACK] Seq=48961 Ack=41961 Win=7192 Len=192
  181 0.010057925 169.254.145.9 → 169.254.144.9 TCP 1040 23317 → 36213 [ACK] Seq=43961 Ack=40961 Win=8192 Len=1000
  182 0.010059413 169.254.144.9 → 169.254.145.9 TCP 40 36213 → 23317 [ACK] Seq=49153 Ack=42961 Win=6192 Len=0
  183 0.010094904 169.254.145.9 → 169.254.144.9 TCP 1040 23317 → 36213 [ACK] Seq=44961 Ack=40961 Win=8192 Len=1000
  184 0.010097354 169.254.144.9 → 169.254.145.9 TCP 40 36213 → 23317 [ACK] Seq=49153 Ack=43961 Win=7192 Len=0
  185 0.010099342 169.254.145.9 → 169.254.144.9 TCP 1040 23317 → 36213 [ACK] Seq=45961 Ack=40961 Win=8192 Len=1000
  186 0.010101432 169.254.144.9 → 169.254.145.9 TCP 40 36213 → 23317 [ACK] Seq=49153 Ack=44961 Win=6192 Len=0
  187 0.010140364 169.254.144.9 → 169.254.145.9 TCP 40 36213 → 23317 [ACK] Seq=49153 Ack=45961 Win=7192 Len=0
  188 0.010142332 169.254.145.9 → 169.254.144.9 TCP 1040 23317 → 36213 [ACK] Seq=46961 Ack=41961 Win=7192 Len=1000
  189 0.010144111 169.254.144.9 → 169.254.145.9 TCP 40 36213 → 23317 [ACK] Seq=49153 Ack=46961 Win=6192 Len=0
  190 0.010146710 169.254.145.9 → 169.254.144.9 TCP 1040 23317 → 36213 [ACK] Seq=47961 Ack=41961 Win=7192 Len=1000
  191 0.010150157 169.254.145.9 → 169.254.144.9 TCP 40 23317 → 36213 [ACK] Seq=48961 Ack=42961 Win=6192 Len=0
  192 0.010182633 169.254.144.9 → 169.254.145.9 TCP 40 36213 → 23317 [ACK] Seq=49153 Ack=47961 Win=7192 Len=0
  193 0.010186500 169.254.144.9 → 169.254.145.9 TCP 40 36213 → 23317 [ACK] Seq=49153 Ack=48961 Win=6192 Len=0
  194 0.010192185 169.254.145.9 → 169.254.144.9 TCP 232 23317 → 36213 [ACK] Seq=48961 Ack=43961 Win=7192 Len=192
  195 0.010196002 169.254.145.9 → 169.254.144.9 TCP 40 23317 → 36213 [ACK] Seq=49153 Ack=44961 Win=6192 Len=0
  196 0.010236157 169.254.145.9 → 169.254.144.9 TCP 40 23317 → 36213 [ACK] Seq=49153 Ack=45961 Win=7192 Len=0
  197 0.010238176 169.254.144.9 → 169.254.145.9 TCP 1040 36213 → 23317 [ACK] Seq=49153 Ack=49153 Win=8000 Len=1000
  198 0.010239573 169.254.145.9 → 169.254.144.9 TCP 40 23317 → 36213 [ACK] Seq=49153 Ack=46961 Win=6192 Len=0
  199 0.010243096 169.254.144.9 → 169.254.145.9 TCP 1040 36213 → 23317 [ACK] Seq=50153 Ack=49153 Win=8000 Len=1000
  200 0.010277590 169.254.144.9 → 169.254.145.9 TCP 1040 36213 → 23317 [ACK] Seq=51153 Ack=49153 Win=8192 Len=1000
  201 0.010279398 169.254.145.9 → 169.254.144.9 TCP 40 23317 → 36213 [ACK] Seq=49153 Ack=47961 Win=7192 Len=0
  202 0.010282509 169.254.144.9 → 169.254.145.9 TCP 1040 36213 → 23317 [ACK] Seq=52153 Ack=49153 Win=8192 Len=1000
  203 0.010282864 169.254.145.9 → 169.254.144.9 TCP 40 23317 → 36213 [ACK] Seq=49153 Ack=48961 Win=6192 Len=0
  204 0.010317975 169.254.144.9 → 169.254.145.9 TCP 1040 36213 → 23317 [ACK] Seq=53153 Ack=49153 Win=8192 Len=1000
  205 0.010319803 169.254.145.9 → 169.254.144.9 TCP 40 23317 → 36213 [ACK] Seq=49153 Ack=49153 Win=8000 Len=0
  206 0.010322834 169.254.144.9 → 169.254.145.9 TCP 1040 36213 → 23317 [ACK] Seq=54153 Ack=49153 Win=8192 Len=1000
  207 0.010343974 169.254.144.9 → 169.254.145.9 TCP 1040 36213 → 23317 [ACK] Seq=55153 Ack=49153 Win=8192 Len=1000
  208 0.010348592 169.254.144.9 → 169.254.145.9 TCP 1040 [TCP Window Full] 36213 → 23317 [ACK] Seq=56153 Ack=49153 Win=8192 Len=1000
  209 0.010356371 169.254.145.9 → 169.254.144.9 TCP 1040 23317 → 36213 [ACK] Seq=49153 Ack=49153 Win=8192 Len=1000
  210 0.010363294 169.254.145.9 → 169.254.144.9 TCP 1040 23317 → 36213 [ACK] Seq=50153 Ack=49153 Win=8192 Len=1000
  211 0.010401004 169.254.145.9 → 169.254.144.9 TCP 1040 23317 → 36213 [ACK] Seq=51153 Ack=49153 Win=8192 Len=1000
  212 0.010405833 169.254.145.9 → 169.254.144.9 TCP 1040 23317 → 36213 [ACK] Seq=52153 Ack=49153 Win=8192 Len=1000
  213 0.010442091 169.254.145.9 → 169.254.144.9 TCP 1040 23317 → 36213 [ACK] Seq=53153 Ack=49153 Win=8192 Len=1000
  214 0.010447992 169.254.145.9 → 169.254.144.9 TCP 1040 23317 → 36213 [ACK] Seq=54153 Ack=49153 Win=8192 Len=1000
  215 0.010493006 169.254.145.9 → 169.254.144.9 TCP 1040 23317 → 36213 [ACK] Seq=55153 Ack=50153 Win=7192 Len=1000
  216 0.010498616 169.254.145.9 → 169.254.144.9 TCP 1040 23317 → 36213 [ACK] Seq=56153 Ack=50153 Win=7192 Len=1000
  217 0.010502103 169.254.145.9 → 169.254.144.9 TCP 40 23317 → 36213 [ACK] Seq=57153 Ack=51153 Win=6192 Len=0
  218 0.010543761 169.254.145.9 → 169.254.144.9 TCP 232 [TCP Window Full] 23317 → 36213 [ACK] Seq=57153 Ack=52153 Win=7192 Len=192
  219 0.010547297 169.254.145.9 → 169.254.144.9 TCP 40 23317 → 36213 [ACK] Seq=57345 Ack=53153 Win=6192 Len=0
  220 0.010586290 169.254.145.9 → 169.254.144.9 TCP 40 23317 → 36213 [ACK] Seq=57345 Ack=54153 Win=7192 Len=0
  221 0.010589957 169.254.145.9 → 169.254.144.9 TCP 40 23317 → 36213 [ACK] Seq=57345 Ack=55153 Win=6192 Len=0
  222 0.010598328 169.254.144.9 → 169.254.145.9 TCP 232 36213 → 23317 [ACK] Seq=57153 Ack=50153 Win=7192 Len=192
  223 0.010607144 169.254.144.9 → 169.254.145.9 TCP 40 36213 → 23317 [ACK] Seq=57345 Ack=51153 Win=6192 Len=0
  224 0.010629340 169.254.145.9 → 169.254.144.9 TCP 40 23317 → 36213 [ACK] Seq=57345 Ack=56153 Win=7192 Len=0
  225 0.010632796 169.254.145.9 → 169.254.144.9 TCP 40 23317 → 36213 [ACK] Seq=57345 Ack=57153 Win=6192 Len=0
  226 0.010647509 169.254.144.9 → 169.254.145.9 TCP 40 36213 → 23317 [ACK] Seq=57345 Ack=52153 Win=7192 Len=0
  227 0.010651307 169.254.144.9 → 169.254.145.9 TCP 40 36213 → 23317 [ACK] Seq=57345 Ack=53153 Win=6192 Len=0
  228 0.010667621 169.254.145.9 → 169.254.144.9 TCP 40 23317 → 36213 [ACK] Seq=57345 Ack=57345 Win=8000 Len=0
  229 0.010691401 169.254.144.9 → 169.254.145.9 TCP 40 36213 → 23317 [ACK] Seq=57345 Ack=54153 Win=7192 Len=0
  230 0.010695459 169.254.144.9 → 169.254.145.9 TCP 40 36213 → 23317 [ACK] Seq=57345 Ack=55153 Win=6192 Len=0
  231 0.010703949 169.254.145.9 → 169.254.144.9 TCP 1040 23317 → 36213 [ACK] Seq=57345 Ack=57345 Win=8000 Len=1000
  232 0.010709169 169.254.145.9 → 169.254.144.9 TCP 1040 23317 → 36213 [ACK] Seq=58345 Ack=57345 Win=8000 Len=1000
  233 0.010734411 169.254.144.9 → 169.254.145.9 TCP 40 36213 → 23317 [ACK] Seq=57345 Ack=56153 Win=7192 Len=0
  234 0.010738259 169.254.144.9 → 169.254.145.9 TCP 40 36213 → 23317 [ACK] Seq=57345 Ack=57153 Win=6192 Len=0
  235 0.010745096 169.254.145.9 → 169.254.144.9 TCP 1040 23317 → 36213 [ACK] Seq=59345 Ack=57345 Win=8000 Len=1000
  236 0.010749554 169.254.145.9 → 169.254.144.9 TCP 1040 23317 → 36213 [ACK] Seq=60345 Ack=57345 Win=8000 Len=1000
  237 0.010785922 169.254.145.9 → 169.254.144.9 TCP 1040 23317 → 36213 [ACK] Seq=61345 Ack=57345 Win=8000 Len=1000
  238 0.010790751 169.254.145.9 → 169.254.144.9 TCP 1040 [TCP Window Full] 23317 → 36213 [ACK] Seq=62345 Ack=57345 Win=8000 Len=1000
  239 0.010791358 169.254.144.9 → 169.254.145.9 TCP 1040 36213 → 23317 [ACK] Seq=57345 Ack=57345 Win=8000 Len=1000
  240 0.010797279 169.254.144.9 → 169.254.145.9 TCP 1040 36213 → 23317 [ACK] Seq=58345 Ack=57345 Win=8000 Len=1000
  241 0.010832775 169.254.144.9 → 169.254.145.9 TCP 1040 36213 → 23317 [ACK] Seq=59345 Ack=57345 Win=8192 Len=1000
  242 0.010838055 169.254.144.9 → 169.254.145.9 TCP 1040 36213 → 23317 [ACK] Seq=60345 Ack=57345 Win=8192 Len=1000
  243 0.010872679 169.254.144.9 → 169.254.145.9 TCP 1040 36213 → 23317 [ACK] Seq=61345 Ack=57345 Win=8192 Len=1000
  244 0.010877999 169.254.144.9 → 169.254.145.9 TCP 1040 36213 → 23317 [ACK] Seq=62345 Ack=57345 Win=8192 Len=1000
  245 0.010915429 169.254.144.9 → 169.254.145.9 TCP 1040 36213 → 23317 [ACK] Seq=63345 Ack=57345 Win=8192 Len=1000
  246 0.010920669 169.254.144.9 → 169.254.145.9 TCP 1040 [TCP Window Full] 36213 → 23317 [ACK] Seq=64345 Ack=57345 Win=8192 Len=1000
  247 0.010923995 169.254.144.9 → 169.254.145.9 TCP 40 36213 → 23317 [ACK] Seq=65345 Ack=58345 Win=7192 Len=0
  248 0.011358395 169.254.144.9 → 169.254.145.9 TCP 40 36213 → 23317 [ACK] Seq=65345 Ack=59345 Win=6192 Len=0
  249 0.011395253 169.254.144.9 → 169.254.145.9 TCP 40 36213 → 23317 [ACK] Seq=65345 Ack=60345 Win=7192 Len=0
  250 0.011457754 169.254.145.9 → 169.254.144.9 TCP 1040 23317 → 36213 [ACK] Seq=63345 Ack=58345 Win=7000 Len=1000
  251 0.011464868 169.254.145.9 → 169.254.144.9 TCP 1040 23317 → 36213 [ACK] Seq=64345 Ack=58345 Win=7000 Len=1000
  252 0.011468554 169.254.145.9 → 169.254.144.9 TCP 40 23317 → 36213 [ACK] Seq=65345 Ack=59345 Win=7192 Len=0
  253 0.011530149 169.254.145.9 → 169.254.144.9 TCP 232 23317 → 36213 [ACK] Seq=65345 Ack=60345 Win=6192 Len=192
  254 0.011533786 169.254.145.9 → 169.254.144.9 TCP 40 23317 → 36213 [ACK] Seq=65537 Ack=61345 Win=7192 Len=0
  255 0.011569378 169.254.144.9 → 169.254.145.9 TCP 40 36213 → 23317 [ACK] Seq=65345 Ack=61345 Win=6192 Len=0
  256 0.011573971 169.254.145.9 → 169.254.144.9 TCP 40 23317 → 36213 [ACK] Seq=65537 Ack=62345 Win=6192 Len=0
  257 0.011574027 169.254.144.9 → 169.254.145.9 TCP 40 36213 → 23317 [ACK] Seq=65345 Ack=62345 Win=7192 Len=0
  258 0.011577497 169.254.145.9 → 169.254.144.9 TCP 40 23317 → 36213 [ACK] Seq=65537 Ack=63345 Win=7192 Len=0
  259 0.011628112 169.254.145.9 → 169.254.144.9 TCP 40 23317 → 36213 [ACK] Seq=65537 Ack=64345 Win=6192 Len=0
  260 0.011631959 169.254.145.9 → 169.254.144.9 TCP 40 23317 → 36213 [ACK] Seq=65537 Ack=65345 Win=7192 Len=0
  261 0.011658324 169.254.144.9 → 169.254.145.9 TCP 40 36213 → 23317 [ACK] Seq=65345 Ack=63345 Win=6192 Len=0
  262 0.011662932 169.254.144.9 → 169.254.145.9 TCP 40 36213 → 23317 [ACK] Seq=65345 Ack=64345 Win=7192 Len=0
  263 0.011704374 169.254.145.9 → 169.254.144.9 TCP 1040 23317 → 36213 [ACK] Seq=65537 Ack=65345 Win=8192 Len=1000
  264 0.011709624 169.254.145.9 → 169.254.144.9 TCP 1040 23317 → 36213 [ACK] Seq=66537 Ack=65345 Win=8192 Len=1000
  265 0.011717875 169.254.144.9 → 169.254.145.9 TCP 40 36213 → 23317 [ACK] Seq=65345 Ack=65345 Win=6192 Len=0
  266 0.011722784 169.254.144.9 → 169.254.145.9 TCP 1040 36213 → 23317 [ACK] Seq=65345 Ack=65345 Win=8192 Len=1000
  267 0.011726581 169.254.144.9 → 169.254.145.9 TCP 232 36213 → 23317 [ACK] Seq=66345 Ack=65345 Win=8192 Len=192
  268 0.011787575 169.254.144.9 → 169.254.145.9 TCP 40 36213 → 23317 [ACK] Seq=66537 Ack=65537 Win=8000 Len=0
  269 0.011792434 169.254.144.9 → 169.254.145.9 TCP 1040 36213 → 23317 [ACK] Seq=66537 Ack=65537 Win=8000 Len=1000
  270 0.011796772 169.254.144.9 → 169.254.145.9 TCP 1040 36213 → 23317 [ACK] Seq=67537 Ack=65537 Win=8000 Len=1000
  271 0.011862639 169.254.145.9 → 169.254.144.9 TCP 1040 23317 → 36213 [ACK] Seq=67537 Ack=65345 Win=8192 Len=1000
  272 0.011868169 169.254.145.9 → 169.254.144.9 TCP 1040 23317 → 36213 [ACK] Seq=68537 Ack=65345 Win=8192 Len=1000
  273 0.011872994 169.254.144.9 → 169.254.145.9 TCP 1040 36213 → 23317 [ACK] Seq=68537 Ack=65537 Win=8192 Len=1000
  274 0.011878254 169.254.144.9 → 169.254.145.9 TCP 1040 36213 → 23317 [ACK] Seq=69537 Ack=65537 Win=8192 Len=1000
  275 0.011908354 169.254.145.9 → 169.254.144.9 TCP 1040 23317 → 36213 [ACK] Seq=69537 Ack=65345 Win=8192 Len=1000
  276 0.011913093 169.254.145.9 → 169.254.144.9 TCP 1040 23317 → 36213 [ACK] Seq=70537 Ack=65345 Win=8192 Len=1000
  277 0.011915363 169.254.144.9 → 169.254.145.9 TCP 1040 36213 → 23317 [ACK] Seq=70537 Ack=65537 Win=8192 Len=1000
  278 0.011920192 169.254.144.9 → 169.254.145.9 TCP 1040 36213 → 23317 [ACK] Seq=71537 Ack=65537 Win=8192 Len=1000
  279 0.011924029 169.254.144.9 → 169.254.145.9 TCP 1040 [TCP Window Full] 36213 → 23317 [ACK] Seq=72537 Ack=66537 Win=7192 Len=1000
  280 0.011976181 169.254.145.9 → 169.254.144.9 TCP 1040 23317 → 36213 [ACK] Seq=71537 Ack=66345 Win=7192 Len=1000
  281 0.011981330 169.254.145.9 → 169.254.144.9 TCP 1040 23317 → 36213 [ACK] Seq=72537 Ack=66345 Win=7192 Len=1000
  282 0.011984977 169.254.145.9 → 169.254.144.9 TCP 40 23317 → 36213 [ACK] Seq=73537 Ack=66537 Win=7000 Len=0
  283 0.012011682 169.254.144.9 → 169.254.145.9 TCP 40 36213 → 23317 [ACK] Seq=73537 Ack=67537 Win=6192 Len=0
  284 0.012019557 169.254.144.9 → 169.254.145.9 TCP 40 36213 → 23317 [ACK] Seq=73537 Ack=68537 Win=7192 Len=0
  285 0.012058244 169.254.145.9 → 169.254.144.9 TCP 40 23317 → 36213 [ACK] Seq=73537 Ack=67537 Win=7192 Len=0
  286 0.012061680 169.254.145.9 → 169.254.144.9 TCP 40 23317 → 36213 [ACK] Seq=73537 Ack=68537 Win=6192 Len=0
  287 0.012069801 169.254.144.9 → 169.254.145.9 TCP 40 36213 → 23317 [ACK] Seq=73537 Ack=69537 Win=6192 Len=0
  288 0.012073868 169.254.144.9 → 169.254.145.9 TCP 40 36213 → 23317 [ACK] Seq=73537 Ack=70537 Win=7192 Len=0
  289 0.012103538 169.254.145.9 → 169.254.144.9 TCP 232 23317 → 36213 [ACK] Seq=73537 Ack=69537 Win=7192 Len=192
  290 0.012107035 169.254.145.9 → 169.254.144.9 TCP 40 23317 → 36213 [ACK] Seq=73729 Ack=70537 Win=6192 Len=0
  291 0.012117089 169.254.144.9 → 169.254.145.9 TCP 40 36213 → 23317 [ACK] Seq=73537 Ack=71537 Win=6192 Len=0
  292 0.012121337 169.254.144.9 → 169.254.145.9 TCP 40 36213 → 23317 [ACK] Seq=73537 Ack=72537 Win=7192 Len=0
  293 0.012148332 169.254.145.9 → 169.254.144.9 TCP 40 23317 → 36213 [ACK] Seq=73729 Ack=71537 Win=7192 Len=0
  294 0.012151848 169.254.145.9 → 169.254.144.9 TCP 40 23317 → 36213 [ACK] Seq=73729 Ack=72537 Win=6192 Len=0
  295 0.012159678 169.254.144.9 → 169.254.145.9 TCP 40 36213 → 23317 [ACK] Seq=73537 Ack=73537 Win=6192 Len=0
  296 0.012192855 169.254.145.9 → 169.254.144.9 TCP 40 23317 → 36213 [ACK] Seq=73729 Ack=73537 Win=7192 Len=0
  297 0.012194173 169.254.144.9 → 169.254.145.9 TCP 1040 36213 → 23317 [ACK] Seq=73537 Ack=73537 Win=8192 Len=1000
  298 0.012199332 169.254.144.9 → 169.254.145.9 TCP 232 36213 → 23317 [ACK] Seq=74537 Ack=73537 Win=8192 Len=192
  299 0.012228281 169.254.145.9 → 169.254.144.9 TCP 1040 23317 → 36213 [ACK] Seq=73729 Ack=73537 Win=8192 Len=1000
  300 0.012232819 169.254.145.9 → 169.254.144.9 TCP 1040 23317 → 36213 [ACK] Seq=74729 Ack=73537 Win=8192 Len=1000
  301 0.012235349 169.254.144.9 → 169.254.145.9 TCP 1040 36213 → 23317 [ACK] Seq=74729 Ack=73729 Win=8000 Len=1000
  302 0.012240619 169.254.144.9 → 169.254.145.9 TCP 1040 36213 → 23317 [ACK] Seq=75729 Ack=73729 Win=8000 Len=1000
  303 0.012268035 169.254.145.9 → 169.254.144.9 TCP 1040 23317 → 36213 [ACK] Seq=75729 Ack=73537 Win=8192 Len=1000
  304 0.012272673 169.254.145.9 → 169.254.144.9 TCP 1040 23317 → 36213 [ACK] Seq=76729 Ack=73537 Win=8192 Len=1000
  305 0.012275384 169.254.144.9 → 169.254.145.9 TCP 1040 36213 → 23317 [ACK] Seq=76729 Ack=73729 Win=8192 Len=1000
  306 0.012281004 169.254.144.9 → 169.254.145.9 TCP 1040 36213 → 23317 [ACK] Seq=77729 Ack=73729 Win=8192 Len=1000
  307 0.012313039 169.254.145.9 → 169.254.144.9 TCP 1040 23317 → 36213 [ACK] Seq=77729 Ack=73537 Win=8192 Len=1000
  308 0.012317677 169.254.145.9 → 169.254.144.9 TCP 1040 23317 → 36213 [ACK] Seq=78729 Ack=73537 Win=8192 Len=1000
  309 0.012320157 169.254.144.9 → 169.254.145.9 TCP 1040 36213 → 23317 [ACK] Seq=78729 Ack=73729 Win=8192 Len=1000
  310 0.012325087 169.254.144.9 → 169.254.145.9 TCP 1040 36213 → 23317 [ACK] Seq=79729 Ack=73729 Win=8192 Len=1000
  311 0.012329435 169.254.144.9 → 169.254.145.9 TCP 1040 [TCP Window Full] 36213 → 23317 [ACK] Seq=80729 Ack=74729 Win=7192 Len=1000
  312 0.012371578 169.254.145.9 → 169.254.144.9 TCP 1040 23317 → 36213 [ACK] Seq=79729 Ack=74537 Win=7192 Len=1000
  313 0.012376367 169.254.145.9 → 169.254.144.9 TCP 1040 23317 → 36213 [ACK] Seq=80729 Ack=74537 Win=7192 Len=1000
  314 0.012379883 169.254.145.9 → 169.254.144.9 TCP 40 23317 → 36213 [ACK] Seq=81729 Ack=74729 Win=7000 Len=0
  315 0.012395207 169.254.144.9 → 169.254.145.9 TCP 40 36213 → 23317 [ACK] Seq=81729 Ack=75729 Win=6192 Len=0
  316 0.012400337 169.254.144.9 → 169.254.145.9 TCP 40 36213 → 23317 [ACK] Seq=81729 Ack=76729 Win=7192 Len=0
  317 0.012431059 169.254.145.9 → 169.254.144.9 TCP 40 23317 → 36213 [ACK] Seq=81729 Ack=75729 Win=7192 Len=0
  318 0.012435046 169.254.145.9 → 169.254.144.9 TCP 40 23317 → 36213 [ACK] Seq=81729 Ack=76729 Win=6192 Len=0
  319 0.012445421 169.254.144.9 → 169.254.145.9 TCP 40 36213 → 23317 [ACK] Seq=81729 Ack=77729 Win=6192 Len=0
  320 0.012449579 169.254.144.9 → 169.254.145.9 TCP 40 36213 → 23317 [ACK] Seq=81729 Ack=78729 Win=7192 Len=0
  321 0.012486352 169.254.145.9 → 169.254.144.9 TCP 232 23317 → 36213 [ACK] Seq=81729 Ack=77729 Win=7192 Len=192
  322 0.012490279 169.254.145.9 → 169.254.144.9 TCP 40 23317 → 36213 [ACK] Seq=81921 Ack=78729 Win=6192 Len=0
  323 0.012497458 169.254.144.9 → 169.254.145.9 TCP 40 36213 → 23317 [ACK] Seq=81729 Ack=79729 Win=6192 Len=0
  324 0.012501806 169.254.144.9 → 169.254.145.9 TCP 40 36213 → 23317 [ACK] Seq=81729 Ack=80729 Win=7192 Len=0
  325 0.012532187 169.254.145.9 → 169.254.144.9 TCP 40 23317 → 36213 [ACK] Seq=81921 Ack=79729 Win=7192 Len=0
  326 0.012535603 169.254.145.9 → 169.254.144.9 TCP 40 23317 → 36213 [ACK] Seq=81921 Ack=80729 Win=6192 Len=0
  327 0.012539647 169.254.144.9 → 169.254.145.9 TCP 40 36213 → 23317 [ACK] Seq=81729 Ack=81729 Win=6192 Len=0
  328 0.012576505 169.254.144.9 → 169.254.145.9 TCP 1040 36213 → 23317 [ACK] Seq=81729 Ack=81729 Win=8192 Len=1000
  329 0.012577031 169.254.145.9 → 169.254.144.9 TCP 40 23317 → 36213 [ACK] Seq=81921 Ack=81729 Win=7192 Len=0
  330 0.012581605 169.254.144.9 → 169.254.145.9 TCP 232 36213 → 23317 [ACK] Seq=82729 Ack=81729 Win=8192 Len=192
  331 0.012614531 169.254.145.9 → 169.254.144.9 TCP 1040 23317 → 36213 [ACK] Seq=81921 Ack=81729 Win=8192 Len=1000
  332 0.012617542 169.254.144.9 → 169.254.145.9 TCP 1040 36213 → 23317 [ACK] Seq=82921 Ack=81921 Win=8000 Len=1000
  333 0.012619129 169.254.145.9 → 169.254.144.9 TCP 1040 23317 → 36213 [ACK] Seq=82921 Ack=81729 Win=8192 Len=1000
  334 0.012623152 169.254.144.9 → 169.254.145.9 TCP 1040 36213 → 23317 [ACK] Seq=83921 Ack=81921 Win=8000 Len=1000
  335 0.012657070 169.254.145.9 → 169.254.144.9 TCP 1040 23317 → 36213 [ACK] Seq=83921 Ack=81729 Win=8192 Len=1000
  336 0.012659490 169.254.144.9 → 169.254.145.9 TCP 1040 36213 → 23317 [ACK] Seq=84921 Ack=81921 Win=8192 Len=1000
  337 0.012662961 169.254.145.9 → 169.254.144.9 TCP 1040 23317 → 36213 [ACK] Seq=84921 Ack=81729 Win=8192 Len=1000
  338 0.012665311 169.254.144.9 → 169.254.145.9 TCP 1040 36213 → 23317 [ACK] Seq=85921 Ack=81921 Win=8192 Len=1000
  339 0.012707049 169.254.144.9 → 169.254.145.9 TCP 1040 36213 → 23317 [ACK] Seq=86921 Ack=81921 Win=8192 Len=1000
  340 0.012710990 169.254.145.9 → 169.254.144.9 TCP 1040 23317 → 36213 [ACK] Seq=85921 Ack=81729 Win=8192 Len=1000
  341 0.012712589 169.254.144.9 → 169.254.145.9 TCP 1040 36213 → 23317 [ACK] Seq=87921 Ack=81921 Win=8192 Len=1000
  342 0.012715899 169.254.145.9 → 169.254.144.9 TCP 1040 23317 → 36213 [ACK] Seq=86921 Ack=81729 Win=8192 Len=1000
  343 0.012716867 169.254.144.9 → 169.254.145.9 TCP 1040 [TCP Window Full] 36213 → 23317 [ACK] Seq=88921 Ack=82921 Win=7192 Len=1000
  344 0.012760923 169.254.145.9 → 169.254.144.9 TCP 1040 23317 → 36213 [ACK] Seq=87921 Ack=82729 Win=7192 Len=1000
  345 0.012765522 169.254.145.9 → 169.254.144.9 TCP 1040 23317 → 36213 [ACK] Seq=88921 Ack=82729 Win=7192 Len=1000
  346 0.012766049 169.254.144.9 → 169.254.145.9 TCP 40 36213 → 23317 [ACK] Seq=89921 Ack=83921 Win=6192 Len=0
  347 0.012770151 169.254.145.9 → 169.254.144.9 TCP 40 23317 → 36213 [ACK] Seq=89921 Ack=82921 Win=7000 Len=0
  348 0.012770236 169.254.144.9 → 169.254.145.9 TCP 40 36213 → 23317 [ACK] Seq=89921 Ack=84921 Win=7192 Len=0
  349 0.012825119 169.254.144.9 → 169.254.145.9 TCP 40 36213 → 23317 [ACK] Seq=89921 Ack=85921 Win=6192 Len=0
  350 0.012829777 169.254.144.9 → 169.254.145.9 TCP 40 36213 → 23317 [ACK] Seq=89921 Ack=86921 Win=7192 Len=0
  351 0.012840402 169.254.145.9 → 169.254.144.9 TCP 40 23317 → 36213 [ACK] Seq=89921 Ack=83921 Win=7192 Len=0
  352 0.012844038 169.254.145.9 → 169.254.144.9 TCP 40 23317 → 36213 [ACK] Seq=89921 Ack=84921 Win=6192 Len=0
  353 0.012879139 169.254.144.9 → 169.254.145.9 TCP 40 36213 → 23317 [ACK] Seq=89921 Ack=87921 Win=6192 Len=0
  354 0.012883868 169.254.144.9 → 169.254.145.9 TCP 40 36213 → 23317 [ACK] Seq=89921 Ack=88921 Win=7192 Len=0
  355 0.012896817 169.254.145.9 → 169.254.144.9 TCP 232 23317 → 36213 [ACK] Seq=89921 Ack=85921 Win=7192 Len=192
  356 0.012900373 169.254.145.9 → 169.254.144.9 TCP 40 23317 → 36213 [ACK] Seq=90113 Ack=86921 Win=6192 Len=0
  357 0.012926468 169.254.144.9 → 169.254.145.9 TCP 40 36213 → 23317 [ACK] Seq=89921 Ack=89921 Win=6192 Len=0
  358 0.012949936 169.254.145.9 → 169.254.144.9 TCP 40 23317 → 36213 [ACK] Seq=90113 Ack=87921 Win=7192 Len=0
  359 0.013007563 169.254.145.9 → 169.254.144.9 TCP 40 23317 → 36213 [ACK] Seq=90113 Ack=88921 Win=6192 Len=0
  360 0.013022046 169.254.144.9 → 169.254.145.9 TCP 1040 36213 → 23317 [ACK] Seq=89921 Ack=89921 Win=8192 Len=1000
  361 0.013032145 169.254.144.9 → 169.254.145.9 TCP 232 36213 → 23317 [ACK] Seq=90921 Ack=89921 Win=8192 Len=192
  362 0.013106984 169.254.144.9 → 169.254.145.9 TCP 1040 36213 → 23317 [ACK] Seq=91113 Ack=90113 Win=8000 Len=1000
  363 0.013112805 169.254.144.9 → 169.254.145.9 TCP 1040 36213 → 23317 [ACK] Seq=92113 Ack=90113 Win=8000 Len=1000
  364 0.013137115 169.254.145.9 → 169.254.144.9 TCP 40 23317 → 36213 [ACK] Seq=90113 Ack=89921 Win=7192 Len=0
  365 0.013151918 169.254.144.9 → 169.254.145.9 TCP 1040 36213 → 23317 [ACK] Seq=93113 Ack=90113 Win=8192 Len=1000
  366 0.013157288 169.254.144.9 → 169.254.145.9 TCP 1040 36213 → 23317 [ACK] Seq=94113 Ack=90113 Win=8192 Len=1000
  367 0.013181493 169.254.144.9 → 169.254.145.9 TCP 1040 36213 → 23317 [ACK] Seq=95113 Ack=90113 Win=8192 Len=1000
  368 0.013181557 169.254.145.9 → 169.254.144.9 TCP 1040 23317 → 36213 [ACK] Seq=90113 Ack=89921 Win=8192 Len=1000
  369 0.013186352 169.254.144.9 → 169.254.145.9 TCP 1040 36213 → 23317 [ACK] Seq=96113 Ack=90113 Win=8192 Len=1000
  370 0.013186907 169.254.145.9 → 169.254.144.9 TCP 1040 23317 → 36213 [ACK] Seq=91113 Ack=89921 Win=8192 Len=1000
  371 0.013224287 169.254.145.9 → 169.254.144.9 TCP 1040 23317 → 36213 [ACK] Seq=92113 Ack=89921 Win=8192 Len=1000
  372 0.013228786 169.254.145.9 → 169.254.144.9 TCP 1040 23317 → 36213 [ACK] Seq=93113 Ack=89921 Win=8192 Len=1000
  373 0.013234732 169.254.144.9 → 169.254.145.9 TCP 1040 [TCP Window Full] 36213 → 23317 [ACK] Seq=97113 Ack=91113 Win=7192 Len=1000
  374 0.013239200 169.254.144.9 → 169.254.145.9 TCP 40 36213 → 23317 [ACK] Seq=98113 Ack=92113 Win=6192 Len=0
  375 0.013264542 169.254.145.9 → 169.254.144.9 TCP 1040 23317 → 36213 [ACK] Seq=94113 Ack=89921 Win=8192 Len=1000
  376 0.013269241 169.254.145.9 → 169.254.144.9 TCP 1040 23317 → 36213 [ACK] Seq=95113 Ack=89921 Win=8192 Len=1000
  377 0.013278053 169.254.144.9 → 169.254.145.9 TCP 40 36213 → 23317 [ACK] Seq=98113 Ack=93113 Win=7192 Len=0
  378 0.013282201 169.254.144.9 → 169.254.145.9 TCP 40 36213 → 23317 [ACK] Seq=98113 Ack=94113 Win=6192 Len=0
  379 0.013312401 169.254.145.9 → 169.254.144.9 TCP 1040 23317 → 36213 [ACK] Seq=96113 Ack=90921 Win=7192 Len=1000
  380 0.013316830 169.254.145.9 → 169.254.144.9 TCP 1040 23317 → 36213 [ACK] Seq=97113 Ack=90921 Win=7192 Len=1000
  381 0.013320386 169.254.145.9 → 169.254.144.9 TCP 40 23317 → 36213 [ACK] Seq=98113 Ack=91113 Win=7000 Len=0
  382 0.013323438 169.254.144.9 → 169.254.145.9 TCP 40 36213 → 23317 [ACK] Seq=98113 Ack=95113 Win=7192 Len=0
  383 0.013327816 169.254.144.9 → 169.254.145.9 TCP 40 36213 → 23317 [ACK] Seq=98113 Ack=96113 Win=6192 Len=0
  384 0.013365761 169.254.145.9 → 169.254.144.9 TCP 40 23317 → 36213 [ACK] Seq=98113 Ack=92113 Win=7192 Len=0
  385 0.013368411 169.254.144.9 → 169.254.145.9 TCP 40 36213 → 23317 [ACK] Seq=98113 Ack=97113 Win=7192 Len=0
  386 0.013369267 169.254.145.9 → 169.254.144.9 TCP 40 23317 → 36213 [ACK] Seq=98113 Ack=93113 Win=6192 Len=0
  387 0.013372359 169.254.144.9 → 169.254.145.9 TCP 40 36213 → 23317 [ACK] Seq=98113 Ack=98113 Win=6192 Len=0
  388 0.013416435 169.254.145.9 → 169.254.144.9 TCP 232 23317 → 36213 [ACK] Seq=98113 Ack=94113 Win=7192 Len=192
  389 0.013420313 169.254.145.9 → 169.254.144.9 TCP 40 23317 → 36213 [ACK] Seq=98305 Ack=95113 Win=6192 Len=0
  390 0.013426249 169.254.144.9 → 169.254.145.9 TCP 1040 36213 → 23317 [ACK] Seq=98113 Ack=98113 Win=8192 Len=1000
  391 0.013431088 169.254.144.9 → 169.254.145.9 TCP 232 36213 → 23317 [ACK] Seq=99113 Ack=98113 Win=8192 Len=192
  392 0.013462591 169.254.145.9 → 169.254.144.9 TCP 40 23317 → 36213 [ACK] Seq=98305 Ack=96113 Win=7192 Len=0
  393 0.013466218 169.254.145.9 → 169.254.144.9 TCP 40 23317 → 36213 [ACK] Seq=98305 Ack=97113 Win=6192 Len=0
  394 0.013470582 169.254.144.9 → 169.254.145.9 TCP 1040 36213 → 23317 [ACK] Seq=99305 Ack=98305 Win=8000 Len=1000
  395 0.013475711 169.254.144.9 → 169.254.145.9 TCP 1040 36213 → 23317 [ACK] Seq=100305 Ack=98305 Win=8000 Len=1000
  396 0.013504479 169.254.145.9 → 169.254.144.9 TCP 40 23317 → 36213 [ACK] Seq=98305 Ack=98113 Win=7192 Len=0
  397 0.013509554 169.254.144.9 → 169.254.145.9 TCP 1040 36213 → 23317 [ACK] Seq=101305 Ack=98305 Win=8192 Len=1000
  398 0.013514694 169.254.144.9 → 169.254.145.9 TCP 1040 36213 → 23317 [ACK] Seq=102305 Ack=98305 Win=8192 Len=1000
  399 0.013534711 169.254.144.9 → 169.254.145.9 TCP 1040 36213 → 23317 [ACK] Seq=103305 Ack=98305 Win=8192 Len=1000
  400 0.013538843 169.254.145.9 → 169.254.144.9 TCP 1040 23317 → 36213 [ACK] Seq=98305 Ack=98113 Win=8192 Len=1000
  401 0.013539330 169.254.144.9 → 169.254.145.9 TCP 1040 36213 → 23317 [ACK] Seq=104305 Ack=98305 Win=8192 Len=1000
  402 0.013543272 169.254.145.9 → 169.254.144.9 TCP 1040 23317 → 36213 [ACK] Seq=99305 Ack=98113 Win=8192 Len=1000
  403 0.013578527 169.254.145.9 → 169.254.144.9 TCP 1040 23317 → 36213 [ACK] Seq=100305 Ack=98113 Win=8192 Len=1000
  404 0.013583036 169.254.145.9 → 169.254.144.9 TCP 1040 23317 → 36213 [ACK] Seq=101305 Ack=98113 Win=8192 Len=1000
  405 0.013617400 169.254.145.9 → 169.254.144.9 TCP 1040 23317 → 36213 [ACK] Seq=102305 Ack=98113 Win=8192 Len=1000
  406 0.013621938 169.254.145.9 → 169.254.144.9 TCP 1040 23317 → 36213 [ACK] Seq=103305 Ack=98113 Win=8192 Len=1000
  407 0.013665660 169.254.145.9 → 169.254.144.9 TCP 1040 23317 → 36213 [ACK] Seq=104305 Ack=99113 Win=7192 Len=1000
  408 0.013670309 169.254.145.9 → 169.254.144.9 TCP 1040 23317 → 36213 [ACK] Seq=105305 Ack=99113 Win=7192 Len=1000
  409 0.013674015 169.254.145.9 → 169.254.144.9 TCP 40 23317 → 36213 [ACK] Seq=106305 Ack=99305 Win=7000 Len=0
  410 0.013714200 169.254.145.9 → 169.254.144.9 TCP 40 23317 → 36213 [ACK] Seq=106305 Ack=100305 Win=7192 Len=0
  411 0.013717697 169.254.145.9 → 169.254.144.9 TCP 40 23317 → 36213 [ACK] Seq=106305 Ack=101305 Win=6192 Len=0
  412 0.013757150 169.254.145.9 → 169.254.144.9 TCP 232 [TCP Window Full] 23317 → 36213 [ACK] Seq=106305 Ack=102305 Win=7192 Len=192
  413 0.013760617 169.254.145.9 → 169.254.144.9 TCP 40 23317 → 36213 [ACK] Seq=106497 Ack=103305 Win=6192 Len=0
  414 0.013799740 169.254.145.9 → 169.254.144.9 TCP 40 23317 → 36213 [ACK] Seq=106497 Ack=104305 Win=7192 Len=0
  415 0.013803467 169.254.145.9 → 169.254.144.9 TCP 40 23317 → 36213 [ACK] Seq=106497 Ack=105305 Win=6192 Len=0
  416 0.014275612 169.254.144.9 → 169.254.145.9 TCP 1040 36213 → 23317 [ACK] Seq=105305 Ack=99305 Win=7192 Len=1000
  417 0.014309215 169.254.144.9 → 169.254.145.9 TCP 40 36213 → 23317 [ACK] Seq=106305 Ack=100305 Win=6192 Len=0
  418 0.014366051 169.254.144.9 → 169.254.145.9 TCP 40 36213 → 23317 [ACK] Seq=106305 Ack=101305 Win=7192 Len=0
  419 0.014370359 169.254.144.9 → 169.254.145.9 TCP 40 36213 → 23317 [ACK] Seq=106305 Ack=102305 Win=6192 Len=0
  420 0.014411456 169.254.144.9 → 169.254.145.9 TCP 40 36213 → 23317 [ACK] Seq=106305 Ack=103305 Win=7192 Len=0
  421 0.014415724 169.254.144.9 → 169.254.145.9 TCP 40 36213 → 23317 [ACK] Seq=106305 Ack=104305 Win=6192 Len=0
  422 0.014456169 169.254.144.9 → 169.254.145.9 TCP 40 36213 → 23317 [ACK] Seq=106305 Ack=105305 Win=7192 Len=0
  423 0.014460437 169.254.144.9 → 169.254.145.9 TCP 40 36213 → 23317 [ACK] Seq=106305 Ack=106305 Win=6192 Len=0
  424 0.014511332 169.254.144.9 → 169.254.145.9 TCP 1040 36213 → 23317 [ACK] Seq=106305 Ack=106305 Win=8192 Len=1000
  425 0.014517293 169.254.144.9 → 169.254.145.9 TCP 232 36213 → 23317 [ACK] Seq=107305 Ack=106305 Win=8192 Len=192
  426 0.014556716 169.254.144.9 → 169.254.145.9 TCP 1040 36213 → 23317 [ACK] Seq=107497 Ack=106497 Win=8000 Len=1000
  427 0.014561826 169.254.144.9 → 169.254.145.9 TCP 1040 36213 → 23317 [ACK] Seq=108497 Ack=106497 Win=8000 Len=1000
  428 0.014605417 169.254.144.9 → 169.254.145.9 TCP 1040 36213 → 23317 [ACK] Seq=109497 Ack=106497 Win=8192 Len=1000
  429 0.014610587 169.254.144.9 → 169.254.145.9 TCP 1040 [TCP Window Full] 36213 → 23317 [ACK] Seq=110497 Ack=106497 Win=8192 Len=1000
  430 0.014811954 169.254.145.9 → 169.254.144.9 TCP 40 23317 → 36213 [ACK] Seq=106497 Ack=106305 Win=7192 Len=0
  431 0.014913183 169.254.145.9 → 169.254.144.9 TCP 1040 23317 → 36213 [ACK] Seq=106497 Ack=106305 Win=8192 Len=1000
  432 0.014919775 169.254.145.9 → 169.254.144.9 TCP 1040 23317 → 36213 [ACK] Seq=107497 Ack=106305 Win=8192 Len=1000
  433 0.014979065 169.254.145.9 → 169.254.144.9 TCP 1040 23317 → 36213 [ACK] Seq=108497 Ack=106305 Win=8192 Len=1000
  434 0.014987531 169.254.145.9 → 169.254.144.9 TCP 1040 23317 → 36213 [ACK] Seq=109497 Ack=106305 Win=8192 Len=1000
  435 0.015044718 169.254.145.9 → 169.254.144.9 TCP 1040 23317 → 36213 [ACK] Seq=110497 Ack=106305 Win=8192 Len=1000
  436 0.015050989 169.254.145.9 → 169.254.144.9 TCP 1040 23317 → 36213 [ACK] Seq=111497 Ack=106305 Win=8192 Len=1000
  437 0.015088798 169.254.144.9 → 169.254.145.9 TCP 1040 36213 → 23317 [ACK] Seq=111497 Ack=106497 Win=8192 Len=1000
  438 0.015111653 169.254.145.9 → 169.254.144.9 TCP 1040 23317 → 36213 [ACK] Seq=112497 Ack=107305 Win=7192 Len=1000
  439 0.015117644 169.254.145.9 → 169.254.144.9 TCP 1040 23317 → 36213 [ACK] Seq=113497 Ack=107305 Win=7192 Len=1000
  440 0.015118804 169.254.144.9 → 169.254.145.9 TCP 1040 36213 → 23317 [ACK] Seq=112497 Ack=106497 Win=8192 Len=1000
  441 0.015122523 169.254.145.9 → 169.254.144.9 TCP 40 23317 → 36213 [ACK] Seq=114497 Ack=107497 Win=7000 Len=0
  442 0.015124034 169.254.144.9 → 169.254.145.9 TCP 1040 [TCP Window Full] 36213 → 23317 [ACK] Seq=113497 Ack=107497 Win=7192 Len=1000
  443 0.015176554 169.254.145.9 → 169.254.144.9 TCP 40 23317 → 36213 [ACK] Seq=114497 Ack=108497 Win=7192 Len=0
  444 0.015180701 169.254.145.9 → 169.254.144.9 TCP 40 23317 → 36213 [ACK] Seq=114497 Ack=109497 Win=6192 Len=0
  445 0.015219792 169.254.144.9 → 169.254.145.9 TCP 40 36213 → 23317 [ACK] Seq=114497 Ack=108497 Win=6192 Len=0
  446 0.015227487 169.254.144.9 → 169.254.145.9 TCP 40 36213 → 23317 [ACK] Seq=114497 Ack=109497 Win=7192 Len=0
  447 0.015230023 169.254.145.9 → 169.254.144.9 TCP 232 23317 → 36213 [ACK] Seq=114497 Ack=110497 Win=7192 Len=192
  448 0.015234602 169.254.145.9 → 169.254.144.9 TCP 40 23317 → 36213 [ACK] Seq=114689 Ack=111497 Win=6192 Len=0
  449 0.015266810 169.254.144.9 → 169.254.145.9 TCP 40 36213 → 23317 [ACK] Seq=114497 Ack=110497 Win=6192 Len=0
  450 0.015271509 169.254.144.9 → 169.254.145.9 TCP 40 36213 → 23317 [ACK] Seq=114497 Ack=111497 Win=7192 Len=0
  451 0.015281730 169.254.145.9 → 169.254.144.9 TCP 40 23317 → 36213 [ACK] Seq=114689 Ack=112497 Win=7192 Len=0
  452 0.015285617 169.254.145.9 → 169.254.144.9 TCP 40 23317 → 36213 [ACK] Seq=114689 Ack=113497 Win=6192 Len=0
  453 0.015326854 169.254.145.9 → 169.254.144.9 TCP 40 23317 → 36213 [ACK] Seq=114689 Ack=114497 Win=7192 Len=0
  454 0.015365676 169.254.145.9 → 169.254.144.9 TCP 1040 23317 → 36213 [ACK] Seq=114689 Ack=114497 Win=8192 Len=1000
  455 0.015371126 169.254.145.9 → 169.254.144.9 TCP 1040 23317 → 36213 [ACK] Seq=115689 Ack=114497 Win=8192 Len=1000
  456 0.015394380 169.254.145.9 → 169.254.144.9 TCP 1040 23317 → 36213 [ACK] Seq=116689 Ack=114497 Win=8192 Len=1000
  457 0.015394588 169.254.144.9 → 169.254.145.9 TCP 40 36213 → 23317 [ACK] Seq=114497 Ack=112497 Win=6192 Len=0
  458 0.015399499 169.254.145.9 → 169.254.144.9 TCP 1040 [TCP Window Full] 23317 → 36213 [ACK] Seq=117689 Ack=114497 Win=8192 Len=1000
  459 0.015407162 169.254.144.9 → 169.254.145.9 TCP 40 36213 → 23317 [ACK] Seq=114497 Ack=113497 Win=7192 Len=0
  460 0.015447196 169.254.144.9 → 169.254.145.9 TCP 40 36213 → 23317 [ACK] Seq=114497 Ack=114497 Win=6192 Len=0
  461 0.015599230 169.254.144.9 → 169.254.145.9 TCP 1040 36213 → 23317 [ACK] Seq=114497 Ack=114497 Win=8192 Len=1000
  462 0.015615180 169.254.144.9 → 169.254.145.9 TCP 232 36213 → 23317 [ACK] Seq=115497 Ack=114497 Win=8192 Len=192
  463 0.015709125 169.254.144.9 → 169.254.145.9 TCP 1040 36213 → 23317 [ACK] Seq=115689 Ack=114689 Win=8000 Len=1000
  464 0.015717380 169.254.144.9 → 169.254.145.9 TCP 1040 36213 → 23317 [ACK] Seq=116689 Ack=114689 Win=8000 Len=1000
  465 0.015762965 169.254.144.9 → 169.254.145.9 TCP 1040 36213 → 23317 [ACK] Seq=117689 Ack=114689 Win=8192 Len=1000
  466 0.015768365 169.254.144.9 → 169.254.145.9 TCP 1040 36213 → 23317 [ACK] Seq=118689 Ack=114689 Win=8192 Len=1000
  467 0.015809181 169.254.144.9 → 169.254.145.9 TCP 1040 36213 → 23317 [ACK] Seq=119689 Ack=114689 Win=8192 Len=1000
  468 0.015814691 169.254.144.9 → 169.254.145.9 TCP 1040 36213 → 23317 [ACK] Seq=120689 Ack=114689 Win=8192 Len=1000
  469 0.015819070 169.254.144.9 → 169.254.145.9 TCP 1040 [TCP Window Full] 36213 → 23317 [ACK] Seq=121689 Ack=115689 Win=7192 Len=1000
  470 0.015879983 169.254.144.9 → 169.254.145.9 TCP 40 36213 → 23317 [ACK] Seq=122689 Ack=116689 Win=6192 Len=0
  471 0.015884602 169.254.144.9 → 169.254.145.9 TCP 40 36213 → 23317 [ACK] Seq=122689 Ack=117689 Win=7192 Len=0
  472 0.015907504 169.254.144.9 → 169.254.145.9 TCP 40 36213 → 23317 [ACK] Seq=122689 Ack=118689 Win=6192 Len=0
  473 0.016562477 169.254.145.9 → 169.254.144.9 TCP 1040 23317 → 36213 [ACK] Seq=118689 Ack=114497 Win=8192 Len=1000
  474 0.016615937 169.254.145.9 → 169.254.144.9 TCP 1040 23317 → 36213 [ACK] Seq=119689 Ack=114497 Win=8192 Len=1000
  475 0.016711655 169.254.145.9 → 169.254.144.9 TCP 1040 23317 → 36213 [ACK] Seq=120689 Ack=115497 Win=7192 Len=1000
  476 0.016717296 169.254.145.9 → 169.254.144.9 TCP 1040 23317 → 36213 [ACK] Seq=121689 Ack=115497 Win=7192 Len=1000
  477 0.016721163 169.254.145.9 → 169.254.144.9 TCP 40 23317 → 36213 [ACK] Seq=122689 Ack=115689 Win=7000 Len=0
  478 0.016768712 169.254.145.9 → 169.254.144.9 TCP 40 23317 → 36213 [ACK] Seq=122689 Ack=116689 Win=7192 Len=0
  479 0.016772418 169.254.145.9 → 169.254.144.9 TCP 40 23317 → 36213 [ACK] Seq=122689 Ack=117689 Win=6192 Len=0
  480 0.016822852 169.254.145.9 → 169.254.144.9 TCP 232 23317 → 36213 [ACK] Seq=122689 Ack=118689 Win=7192 Len=192
  481 0.016826740 169.254.145.9 → 169.254.144.9 TCP 40 23317 → 36213 [ACK] Seq=122881 Ack=119689 Win=6192 Len=0
  482 0.016871062 169.254.145.9 → 169.254.144.9 TCP 40 23317 → 36213 [ACK] Seq=122881 Ack=120689 Win=7192 Len=0
  483 0.016874619 169.254.145.9 → 169.254.144.9 TCP 40 23317 → 36213 [ACK] Seq=122881 Ack=121689 Win=6192 Len=0
  484 0.016916707 169.254.145.9 → 169.254.144.9 TCP 40 23317 → 36213 [ACK] Seq=122881 Ack=122689 Win=7192 Len=0
  485 0.016993190 169.254.145.9 → 169.254.144.9 TCP 1040 23317 → 36213 [ACK] Seq=122881 Ack=122689 Win=8192 Len=1000
  486 0.016999973 169.254.145.9 → 169.254.144.9 TCP 1040 [TCP Window Full] 23317 → 36213 [ACK] Seq=123881 Ack=122689 Win=8192 Len=1000
  487 0.017009669 169.254.144.9 → 169.254.145.9 TCP 40 36213 → 23317 [ACK] Seq=122689 Ack=119689 Win=7192 Len=0
  488 0.017045806 169.254.144.9 → 169.254.145.9 TCP 40 36213 → 23317 [ACK] Seq=122689 Ack=120689 Win=6192 Len=0
  489 0.017133680 169.254.144.9 → 169.254.145.9 TCP 40 36213 → 23317 [ACK] Seq=122689 Ack=121689 Win=7192 Len=0
  490 0.017138960 169.254.144.9 → 169.254.145.9 TCP 40 36213 → 23317 [ACK] Seq=122689 Ack=122689 Win=6192 Len=0
  491 0.017195225 169.254.144.9 → 169.254.145.9 TCP 1040 36213 → 23317 [ACK] Seq=122689 Ack=122689 Win=8192 Len=1000
  492 0.017201336 169.254.144.9 → 169.254.145.9 TCP 232 36213 → 23317 [ACK] Seq=123689 Ack=122689 Win=8192 Len=192
  493 0.017241331 169.254.144.9 → 169.254.145.9 TCP 1040 36213 → 23317 [ACK] Seq=123881 Ack=122881 Win=8000 Len=1000
  494 0.017247863 169.254.144.9 → 169.254.145.9 TCP 1040 36213 → 23317 [ACK] Seq=124881 Ack=122881 Win=8000 Len=1000
  495 0.017286625 169.254.144.9 → 169.254.145.9 TCP 1040 36213 → 23317 [ACK] Seq=125881 Ack=122881 Win=8192 Len=1000
  496 0.017370732 169.254.144.9 → 169.254.145.9 TCP 1040 36213 → 23317 [ACK] Seq=126881 Ack=122881 Win=8192 Len=1000
  497 0.017449639 169.254.144.9 → 169.254.145.9 TCP 1040 36213 → 23317 [ACK] Seq=127881 Ack=122881 Win=8192 Len=1000
  498 0.017454969 169.254.144.9 → 169.254.145.9 TCP 1040 36213 → 23317 [ACK] Seq=128881 Ack=122881 Win=8192 Len=1000
  499 0.017459488 169.254.144.9 → 169.254.145.9 TCP 1040 [TCP Window Full] 36213 → 23317 [ACK] Seq=129881 Ack=123881 Win=7192 Len=1000
  500 0.017489023 169.254.144.9 → 169.254.145.9 TCP 40 36213 → 23317 [ACK] Seq=130881 Ack=124881 Win=6192 Len=0
  501 0.017553454 169.254.145.9 → 169.254.144.9 TCP 1040 23317 → 36213 [ACK] Seq=124881 Ack=122689 Win=8192 Len=1000
  502 0.017563283 169.254.145.9 → 169.254.144.9 TCP 1040 23317 → 36213 [ACK] Seq=125881 Ack=122689 Win=8192 Len=1000
  503 0.017604459 169.254.145.9 → 169.254.144.9 TCP 1040 23317 → 36213 [ACK] Seq=126881 Ack=122689 Win=8192 Len=1000
  504 0.017609910 169.254.145.9 → 169.254.144.9 TCP 1040 23317 → 36213 [ACK] Seq=127881 Ack=122689 Win=8192 Len=1000
  505 0.017681022 169.254.145.9 → 169.254.144.9 TCP 1040 23317 → 36213 [ACK] Seq=128881 Ack=123689 Win=7192 Len=1000
  506 0.017686342 169.254.145.9 → 169.254.144.9 TCP 1040 23317 → 36213 [ACK] Seq=129881 Ack=123689 Win=7192 Len=1000
  507 0.017690660 169.254.145.9 → 169.254.144.9 TCP 40 23317 → 36213 [ACK] Seq=130881 Ack=123881 Win=7000 Len=0
  508 0.017745833 169.254.145.9 → 169.254.144.9 TCP 40 23317 → 36213 [ACK] Seq=130881 Ack=124881 Win=7192 Len=0
  509 0.017749850 169.254.145.9 → 169.254.144.9 TCP 40 23317 → 36213 [ACK] Seq=130881 Ack=125881 Win=6192 Len=0
  510 0.017815333 169.254.145.9 → 169.254.144.9 TCP 232 23317 → 36213 [FIN, ACK] Seq=130881 Ack=126881 Win=7192 Len=192
  511 0.017853832 169.254.144.9 → 169.254.145.9 TCP 40 36213 → 23317 [ACK] Seq=130881 Ack=125881 Win=7192 Len=0
  512 0.017894578 169.254.144.9 → 169.254.145.9 TCP 40 36213 → 23317 [ACK] Seq=130881 Ack=126881 Win=6192 Len=0
  513 0.018154224 169.254.145.9 → 169.254.144.9 TCP 40 23317 → 36213 [ACK] Seq=131074 Ack=128881 Win=7192 Len=0
  514 0.018159214 169.254.145.9 → 169.254.144.9 TCP 40 23317 → 36213 [ACK] Seq=131074 Ack=129881 Win=6192 Len=0
  515 0.018202401 169.254.144.9 → 169.254.145.9 TCP 40 36213 → 23317 [ACK] Seq=130881 Ack=127881 Win=7192 Len=0
  516 0.018205610 169.254.145.9 → 169.254.144.9 TCP 40 23317 → 36213 [ACK] Seq=131074 Ack=130881 Win=7192 Len=0
  517 0.018212550 169.254.144.9 → 169.254.145.9 TCP 40 36213 → 23317 [ACK] Seq=130881 Ack=128881 Win=6192 Len=0
  518 0.018312116 169.254.144.9 → 169.254.145.9 TCP 40 36213 → 23317 [ACK] Seq=130881 Ack=129881 Win=7192 Len=0
  519 0.018318498 169.254.144.9 → 169.254.145.9 TCP 40 36213 → 23317 [ACK] Seq=130881 Ack=130881 Win=6192 Len=0
  520 0.018367780 169.254.144.9 → 169.254.145.9 TCP 232 36213 → 23317 [FIN, ACK] Seq=130881 Ack=130881 Win=8192 Len=192
  521 0.019284688 169.254.144.9 → 169.254.145.9 TCP 40 36213 → 23317 [ACK] Seq=131074 Ack=131074 Win=8000 Len=0
  522 0.031005316 169.254.144.9 → 169.254.145.9 TCP 232 [TCP Retransmission] 36213 → 23317 [FIN, ACK] Seq=130881 Ack=131074 Win=8192 Len=192
  523 0.055014592 169.254.144.9 → 169.254.145.9 TCP 232 [TCP Retransmission] 36213 → 23317 [FIN, ACK] Seq=130881 Ack=131074 Win=8192 Len=192
  524 0.103048009 169.254.144.9 → 169.254.145.9 TCP 232 [TCP Retransmission] 36213 → 23317 [FIN, ACK] Seq=130881 Ack=131074 Win=8192 Len=192
  525 0.198997937 169.254.144.9 → 169.254.145.9 TCP 232 [TCP Retransmission] 36213 → 23317 [FIN, ACK] Seq=130881 Ack=131074 Win=8192 Len=192
  526 0.391042737 169.254.144.9 → 169.254.145.9 TCP 232 [TCP Retransmission] 36213 → 23317 [FIN, ACK] Seq=130881 Ack=131074 Win=8192 Len=192
  527 0.775009476 169.254.144.9 → 169.254.145.9 TCP 232 [TCP Retransmission] 36213 → 23317 [FIN, ACK] Seq=130881 Ack=131074 Win=8192 Len=192
  528 1.543008867 169.254.144.9 → 169.254.145.9 TCP 232 [TCP Retransmission] 36213 → 23317 [FIN, ACK] Seq=130881 Ack=131074 Win=8192 Len=192
  529 3.079008693 169.254.144.9 → 169.254.145.9 TCP 232 [TCP Retransmission] 36213 → 23317 [FIN, ACK] Seq=130881 Ack=131074 Win=8192 Len=192
  530 6.151005197 169.254.144.9 → 169.254.145.9 TCP 232 [TCP Retransmission] 36213 → 23317 [FIN, RST] Seq=130881 Win=0 Len=192