Running as user "root" and group "root". This could be dangerous.
Capturing on 'tun144'
    1 0.000000000 169.254.144.9 → 169.254.145.9 TCP 40 22570 → 7991 [SYN] Seq=0 Win=0 Len=0
    2 0.000841661 169.254.145.9 → 169.254.144.9 TCP 40 7991 → 22570 [SYN, ACK] Seq=0 Ack=1 Win=8192 Len=0
    3 0.001917325 169.254.144.9 → 169.254.145.9 TCP 40 22570 → 7991 [ACK] Seq=1 Ack=1 Win=8192 Len=0
    4 0.002896651 169.254.144.9 → 169.254.145.9 TCP 1040 22570 → 7991 [ACK] Seq=1 Ack=1 Win=8192 Len=1000
    5 0.002965048 169.254.144.9 → 169.254.145.9 TCP 1040 22570 → 7991 [ACK] Seq=1001 Ack=1 Win=8192 Len=1000
    6 0.002970918 169.254.144.9 → 169.254.145.9 TCP 1040 22570 → 7991 [ACK] Seq=2001 Ack=1 Win=8192 Len=1000
    7 0.002977771 169.254.144.9 → 169.254.145.9 TCP 1040 22570 → 7991 [ACK] Seq=3001 Ack=1 Win=8192 Len=1000
    8 0.002984093 169.254.144.9 → 169.254.145.9 TCP 1040 22570 → 7991 [ACK] Seq=4001 Ack=1 Win=8192 Len=1000
    9 0.002990264 169.254.144.9 → 169.254.145.9 TCP 1040 22570 → 7991 [ACK] Seq=5001 Ack=1 Win=8192 Len=1000
   10 0.002996376 169.254.144.9 → 169.254.145.9 TCP 1040 22570 → 7991 [ACK] Seq=6001 Ack=1 Win=8192 Len=1000
   11 0.003002717 169.254.144.9 → 169.254.145.9 TCP 1040 22570 → 7991 [ACK] Seq=7001 Ack=1 Win=8192 Len=1000
   12 0.003007657 169.254.144.9 → 169.254.145.9 TCP 232 [TCP Window Full] 22570 → 7991 [ACK] Seq=8001 Ack=1 Win=8192 Len=192
   13 0.005880083 169.254.145.9 → 169.254.144.9 TCP 40 7991 → 22570 [ACK] Seq=1 Ack=1001 Win=7192 Len=0
   14 0.005919436 169.254.145.9 → 169.254.144.9 TCP 40 7991 → 22570 [ACK] Seq=1 Ack=2001 Win=6192 Len=0
   15 0.005927010 169.254.145.9 → 169.254.144.9 TCP 1040 7991 → 22570 [ACK] Seq=1 Ack=2001 Win=6192 Len=1000
   16 0.005933251 169.254.145.9 → 169.254.144.9 TCP 1040 7991 → 22570 [ACK] Seq=1001 Ack=2001 Win=6192 Len=1000
   17 0.005938912 169.254.145.9 → 169.254.144.9 TCP 1040 7991 → 22570 [ACK] Seq=2001 Ack=2001 Win=6192 Len=1000
   18 0.005947488 169.254.145.9 → 169.254.144.9 TCP 1040 7991 → 22570 [ACK] Seq=3001 Ack=2001 Win=6192 Len=1000
   19 0.005952607 169.254.145.9 → 169.254.144.9 TCP 1040 7991 → 22570 [ACK] Seq=4001 Ack=2001 Win=6192 Len=1000
   20 0.005958468 169.254.145.9 → 169.254.144.9 TCP 1040 7991 → 22570 [ACK] Seq=5001 Ack=2001 Win=6192 Len=1000
   21 0.005965120 169.254.145.9 → 169.254.144.9 TCP 1040 7991 → 22570 [ACK] Seq=6001 Ack=2001 Win=6192 Len=1000
   22 0.005971232 169.254.145.9 → 169.254.144.9 TCP 1040 7991 → 22570 [ACK] Seq=7001 Ack=2001 Win=6192 Len=1000
   23 0.005976351 169.254.145.9 → 169.254.144.9 TCP 232 [TCP Window Full] 7991 → 22570 [ACK] Seq=8001 Ack=2001 Win=6192 Len=192
   24 0.007202053 169.254.144.9 → 169.254.145.9 TCP 40 22570 → 7991 [ACK] Seq=8193 Ack=1001 Win=7192 Len=0
   25 0.007210770 169.254.145.9 → 169.254.144.9 TCP 40 7991 → 22570 [ACK] Seq=8193 Ack=3001 Win=7192 Len=0
   26 0.007217442 169.254.145.9 → 169.254.144.9 TCP 40 7991 → 22570 [ACK] Seq=8193 Ack=4001 Win=6192 Len=0
   27 0.007222291 169.254.144.9 → 169.254.145.9 TCP 40 22570 → 7991 [ACK] Seq=8193 Ack=2001 Win=6192 Len=0
   28 0.007295647 169.254.144.9 → 169.254.145.9 TCP 40 22570 → 7991 [ACK] Seq=8193 Ack=3001 Win=7192 Len=0
   29 0.007301878 169.254.144.9 → 169.254.145.9 TCP 40 22570 → 7991 [ACK] Seq=8193 Ack=4001 Win=6192 Len=0
   30 0.007336453 169.254.145.9 → 169.254.144.9 TCP 40 7991 → 22570 [ACK] Seq=8193 Ack=5001 Win=7192 Len=0
   31 0.007340320 169.254.145.9 → 169.254.144.9 TCP 40 7991 → 22570 [ACK] Seq=8193 Ack=6001 Win=6192 Len=0
   32 0.007440746 169.254.144.9 → 169.254.145.9 TCP 40 22570 → 7991 [ACK] Seq=8193 Ack=5001 Win=7192 Len=0
   33 0.007452568 169.254.144.9 → 169.254.145.9 TCP 40 22570 → 7991 [ACK] Seq=8193 Ack=6001 Win=6192 Len=0
   34 0.007536814 169.254.144.9 → 169.254.145.9 TCP 40 22570 → 7991 [ACK] Seq=8193 Ack=7001 Win=7192 Len=0
   35 0.007541963 169.254.144.9 → 169.254.145.9 TCP 40 22570 → 7991 [ACK] Seq=8193 Ack=8001 Win=6192 Len=0
   36 0.007605712 169.254.144.9 → 169.254.145.9 TCP 40 22570 → 7991 [ACK] Seq=8193 Ack=8193 Win=8000 Len=0
   37 0.007612204 169.254.144.9 → 169.254.145.9 TCP 1040 22570 → 7991 [ACK] Seq=8193 Ack=8193 Win=8000 Len=1000
   38 0.007617013 169.254.144.9 → 169.254.145.9 TCP 1040 22570 → 7991 [ACK] Seq=9193 Ack=8193 Win=8000 Len=1000
   39 0.007648582 169.254.145.9 → 169.254.144.9 TCP 40 7991 → 22570 [ACK] Seq=8193 Ack=7001 Win=7192 Len=0
   40 0.007654212 169.254.145.9 → 169.254.144.9 TCP 40 7991 → 22570 [ACK] Seq=8193 Ack=8001 Win=6192 Len=0
   41 0.007725864 169.254.144.9 → 169.254.145.9 TCP 1040 22570 → 7991 [ACK] Seq=10193 Ack=8193 Win=8192 Len=1000
   42 0.007733949 169.254.144.9 → 169.254.145.9 TCP 1040 22570 → 7991 [ACK] Seq=11193 Ack=8193 Win=8192 Len=1000
   43 0.007755800 169.254.145.9 → 169.254.144.9 TCP 40 7991 → 22570 [ACK] Seq=8193 Ack=8193 Win=8000 Len=0
   44 0.007807265 169.254.144.9 → 169.254.145.9 TCP 1040 22570 → 7991 [ACK] Seq=12193 Ack=8193 Win=8192 Len=1000
   45 0.007815410 169.254.144.9 → 169.254.145.9 TCP 1040 22570 → 7991 [ACK] Seq=13193 Ack=8193 Win=8192 Len=1000
   46 0.007864251 169.254.144.9 → 169.254.145.9 TCP 1040 22570 → 7991 [ACK] Seq=14193 Ack=8193 Win=8192 Len=1000
   47 0.007870012 169.254.144.9 → 169.254.145.9 TCP 1040 [TCP Window Full] 22570 → 7991 [ACK] Seq=15193 Ack=8193 Win=8192 Len=1000
   48 0.007870503 169.254.145.9 → 169.254.144.9 TCP 1040 7991 → 22570 [ACK] Seq=8193 Ack=8193 Win=8192 Len=1000
   49 0.007875522 169.254.145.9 → 169.254.144.9 TCP 1040 7991 → 22570 [ACK] Seq=9193 Ack=8193 Win=8192 Len=1000
   50 0.007966992 169.254.145.9 → 169.254.144.9 TCP 1040 7991 → 22570 [ACK] Seq=10193 Ack=8193 Win=8192 Len=1000
   51 0.007971199 169.254.144.9 → 169.254.145.9 TCP 232 [TCP Window Full] 22570 → 7991 [ACK] Seq=16193 Ack=9193 Win=7192 Len=192
   52 0.007971621 169.254.145.9 → 169.254.144.9 TCP 1040 7991 → 22570 [ACK] Seq=11193 Ack=8193 Win=8192 Len=1000
   53 0.007976840 169.254.144.9 → 169.254.145.9 TCP 40 22570 → 7991 [ACK] Seq=16385 Ack=10193 Win=6192 Len=0
   54 0.008066537 169.254.145.9 → 169.254.144.9 TCP 1040 7991 → 22570 [ACK] Seq=12193 Ack=8193 Win=8192 Len=1000
   55 0.008072237 169.254.145.9 → 169.254.144.9 TCP 1040 7991 → 22570 [ACK] Seq=13193 Ack=8193 Win=8192 Len=1000
   56 0.008076975 169.254.144.9 → 169.254.145.9 TCP 40 22570 → 7991 [ACK] Seq=16385 Ack=11193 Win=7192 Len=0
   57 0.008084439 169.254.144.9 → 169.254.145.9 TCP 40 22570 → 7991 [ACK] Seq=16385 Ack=12193 Win=6192 Len=0
   58 0.008166251 169.254.145.9 → 169.254.144.9 TCP 1040 7991 → 22570 [ACK] Seq=14193 Ack=8193 Win=8192 Len=1000
   59 0.008171121 169.254.145.9 → 169.254.144.9 TCP 1040 7991 → 22570 [ACK] Seq=15193 Ack=8193 Win=8192 Len=1000
   60 0.008174707 169.254.144.9 → 169.254.145.9 TCP 40 22570 → 7991 [ACK] Seq=16385 Ack=13193 Win=7192 Len=0
   61 0.008174787 169.254.145.9 → 169.254.144.9 TCP 40 7991 → 22570 [ACK] Seq=16193 Ack=9193 Win=7192 Len=0
   62 0.008179225 169.254.144.9 → 169.254.145.9 TCP 40 22570 → 7991 [ACK] Seq=16385 Ack=14193 Win=6192 Len=0
   63 0.008272458 169.254.144.9 → 169.254.145.9 TCP 40 22570 → 7991 [ACK] Seq=16385 Ack=15193 Win=7192 Len=0
   64 0.008275915 169.254.145.9 → 169.254.144.9 TCP 40 7991 → 22570 [ACK] Seq=16193 Ack=10193 Win=6192 Len=0
   65 0.008277507 169.254.144.9 → 169.254.145.9 TCP 40 22570 → 7991 [ACK] Seq=16385 Ack=16193 Win=6192 Len=0
   66 0.008281425 169.254.145.9 → 169.254.144.9 TCP 232 7991 → 22570 [ACK] Seq=16193 Ack=11193 Win=7192 Len=192
   67 0.008323022 169.254.145.9 → 169.254.144.9 TCP 40 7991 → 22570 [ACK] Seq=16385 Ack=12193 Win=6192 Len=0
   68 0.008326479 169.254.145.9 → 169.254.144.9 TCP 40 7991 → 22570 [ACK] Seq=16385 Ack=13193 Win=7192 Len=0
   69 0.008352777 169.254.144.9 → 169.254.145.9 TCP 1040 22570 → 7991 [ACK] Seq=16385 Ack=16385 Win=8000 Len=1000
   70 0.008460016 169.254.145.9 → 169.254.144.9 TCP 40 7991 → 22570 [ACK] Seq=16385 Ack=14193 Win=6192 Len=0
   71 0.008467971 169.254.145.9 → 169.254.144.9 TCP 40 7991 → 22570 [ACK] Seq=16385 Ack=15193 Win=7192 Len=0
   72 0.008385467 169.254.144.9 → 169.254.145.9 TCP 1040 22570 → 7991 [ACK] Seq=17385 Ack=16385 Win=8000 Len=1000
   73 0.008588855 169.254.145.9 → 169.254.144.9 TCP 40 7991 → 22570 [ACK] Seq=16385 Ack=16193 Win=6192 Len=0
   74 0.008592752 169.254.145.9 → 169.254.144.9 TCP 40 7991 → 22570 [ACK] Seq=16385 Ack=16385 Win=8000 Len=0
   75 0.008649538 169.254.145.9 → 169.254.144.9 TCP 1040 7991 → 22570 [ACK] Seq=16385 Ack=16385 Win=8192 Len=1000
   76 0.008654477 169.254.145.9 → 169.254.144.9 TCP 1040 7991 → 22570 [ACK] Seq=17385 Ack=16385 Win=8192 Len=1000
   77 0.008658564 169.254.144.9 → 169.254.145.9 TCP 1040 22570 → 7991 [ACK] Seq=18385 Ack=16385 Win=8192 Len=1000
   78 0.008665477 169.254.144.9 → 169.254.145.9 TCP 1040 22570 → 7991 [ACK] Seq=19385 Ack=16385 Win=8192 Len=1000
   79 0.008702005 169.254.145.9 → 169.254.144.9 TCP 1040 7991 → 22570 [ACK] Seq=18385 Ack=16385 Win=8192 Len=1000
   80 0.008706583 169.254.145.9 → 169.254.144.9 TCP 1040 7991 → 22570 [ACK] Seq=19385 Ack=16385 Win=8192 Len=1000
   81 0.008713556 169.254.144.9 → 169.254.145.9 TCP 1040 22570 → 7991 [ACK] Seq=20385 Ack=16385 Win=8192 Len=1000
   82 0.008719447 169.254.144.9 → 169.254.145.9 TCP 1040 22570 → 7991 [ACK] Seq=21385 Ack=16385 Win=8192 Len=1000
   83 0.008748200 169.254.145.9 → 169.254.144.9 TCP 1040 7991 → 22570 [ACK] Seq=20385 Ack=16385 Win=8192 Len=1000
   84 0.008752699 169.254.145.9 → 169.254.144.9 TCP 1040 7991 → 22570 [ACK] Seq=21385 Ack=16385 Win=8192 Len=1000
   85 0.008782524 169.254.144.9 → 169.254.145.9 TCP 1040 22570 → 7991 [ACK] Seq=22385 Ack=16385 Win=8192 Len=1000
   86 0.008789436 169.254.144.9 → 169.254.145.9 TCP 1040 22570 → 7991 [ACK] Seq=23385 Ack=16385 Win=8192 Len=1000
   87 0.008793564 169.254.144.9 → 169.254.145.9 TCP 232 [TCP Window Full] 22570 → 7991 [ACK] Seq=24385 Ack=17385 Win=7192 Len=192
   88 0.008807240 169.254.145.9 → 169.254.144.9 TCP 1040 7991 → 22570 [ACK] Seq=22385 Ack=17385 Win=7192 Len=1000
   89 0.008812750 169.254.145.9 → 169.254.144.9 TCP 1040 7991 → 22570 [ACK] Seq=23385 Ack=17385 Win=7192 Len=1000
   90 0.008817038 169.254.145.9 → 169.254.144.9 TCP 40 7991 → 22570 [ACK] Seq=24385 Ack=18385 Win=6192 Len=0
   91 0.008856921 169.254.144.9 → 169.254.145.9 TCP 40 22570 → 7991 [ACK] Seq=24577 Ack=18385 Win=6192 Len=0
   92 0.008861350 169.254.144.9 → 169.254.145.9 TCP 40 22570 → 7991 [ACK] Seq=24577 Ack=19385 Win=7192 Len=0
   93 0.008863775 169.254.145.9 → 169.254.144.9 TCP 232 7991 → 22570 [ACK] Seq=24385 Ack=19385 Win=7192 Len=192
   94 0.008867452 169.254.145.9 → 169.254.144.9 TCP 40 7991 → 22570 [ACK] Seq=24577 Ack=20385 Win=6192 Len=0
   95 0.008906503 169.254.144.9 → 169.254.145.9 TCP 40 22570 → 7991 [ACK] Seq=24577 Ack=20385 Win=6192 Len=0
   96 0.008910922 169.254.144.9 → 169.254.145.9 TCP 40 22570 → 7991 [ACK] Seq=24577 Ack=21385 Win=7192 Len=0
   97 0.008912746 169.254.145.9 → 169.254.144.9 TCP 40 7991 → 22570 [ACK] Seq=24577 Ack=21385 Win=7192 Len=0
   98 0.008916412 169.254.145.9 → 169.254.144.9 TCP 40 7991 → 22570 [ACK] Seq=24577 Ack=22385 Win=6192 Len=0
   99 0.008951938 169.254.144.9 → 169.254.145.9 TCP 40 22570 → 7991 [ACK] Seq=24577 Ack=22385 Win=6192 Len=0
  100 0.008958530 169.254.144.9 → 169.254.145.9 TCP 40 22570 → 7991 [ACK] Seq=24577 Ack=23385 Win=7192 Len=0
  101 0.008959172 169.254.145.9 → 169.254.144.9 TCP 40 7991 → 22570 [ACK] Seq=24577 Ack=23385 Win=7192 Len=0
  102 0.008963299 169.254.145.9 → 169.254.144.9 TCP 40 7991 → 22570 [ACK] Seq=24577 Ack=24385 Win=6192 Len=0
  103 0.009004094 169.254.144.9 → 169.254.145.9 TCP 40 22570 → 7991 [ACK] Seq=24577 Ack=24385 Win=6192 Len=0
  104 0.009006169 169.254.145.9 → 169.254.144.9 TCP 40 7991 → 22570 [ACK] Seq=24577 Ack=24577 Win=8000 Len=0
  105 0.009049499 169.254.145.9 → 169.254.144.9 TCP 1040 7991 → 22570 [ACK] Seq=24577 Ack=24577 Win=8192 Len=1000
  106 0.009053606 169.254.144.9 → 169.254.145.9 TCP 1040 22570 → 7991 [ACK] Seq=24577 Ack=24577 Win=8000 Len=1000
  107 0.009054298 169.254.145.9 → 169.254.144.9 TCP 1040 7991 → 22570 [ACK] Seq=25577 Ack=24577 Win=8192 Len=1000
  108 0.009058936 169.254.144.9 → 169.254.145.9 TCP 1040 22570 → 7991 [ACK] Seq=25577 Ack=24577 Win=8000 Len=1000
  109 0.009092789 169.254.145.9 → 169.254.144.9 TCP 1040 7991 → 22570 [ACK] Seq=26577 Ack=24577 Win=8192 Len=1000
  110 0.009096085 169.254.144.9 → 169.254.145.9 TCP 1040 22570 → 7991 [ACK] Seq=26577 Ack=24577 Win=8192 Len=1000
  111 0.009097228 169.254.145.9 → 169.254.144.9 TCP 1040 7991 → 22570 [ACK] Seq=27577 Ack=24577 Win=8192 Len=1000
  112 0.009101024 169.254.144.9 → 169.254.145.9 TCP 1040 22570 → 7991 [ACK] Seq=27577 Ack=24577 Win=8192 Len=1000
  113 0.009133455 169.254.145.9 → 169.254.144.9 TCP 1040 7991 → 22570 [ACK] Seq=28577 Ack=24577 Win=8192 Len=1000
  114 0.009135368 169.254.144.9 → 169.254.145.9 TCP 1040 22570 → 7991 [ACK] Seq=28577 Ack=24577 Win=8192 Len=1000
  115 0.009137883 169.254.145.9 → 169.254.144.9 TCP 1040 7991 → 22570 [ACK] Seq=29577 Ack=24577 Win=8192 Len=1000
  116 0.009140497 169.254.144.9 → 169.254.145.9 TCP 1040 22570 → 7991 [ACK] Seq=29577 Ack=24577 Win=8192 Len=1000
  117 0.009182365 169.254.144.9 → 169.254.145.9 TCP 1040 22570 → 7991 [ACK] Seq=30577 Ack=24577 Win=8192 Len=1000
  118 0.009184590 169.254.145.9 → 169.254.144.9 TCP 1040 7991 → 22570 [ACK] Seq=30577 Ack=25577 Win=7192 Len=1000
  119 0.009187565 169.254.144.9 → 169.254.145.9 TCP 1040 22570 → 7991 [ACK] Seq=31577 Ack=24577 Win=8192 Len=1000
  120 0.009188998 169.254.145.9 → 169.254.144.9 TCP 1040 7991 → 22570 [ACK] Seq=31577 Ack=25577 Win=7192 Len=1000
  121 0.009191181 169.254.144.9 → 169.254.145.9 TCP 232 [TCP Window Full] 22570 → 7991 [ACK] Seq=32577 Ack=25577 Win=7192 Len=192
  122 0.009193065 169.254.145.9 → 169.254.144.9 TCP 40 7991 → 22570 [ACK] Seq=32577 Ack=26577 Win=6192 Len=0
  123 0.009240242 169.254.144.9 → 169.254.145.9 TCP 40 22570 → 7991 [ACK] Seq=32769 Ack=26577 Win=6192 Len=0
  124 0.009244640 169.254.144.9 → 169.254.145.9 TCP 40 22570 → 7991 [ACK] Seq=32769 Ack=27577 Win=7192 Len=0
  125 0.009256493 169.254.145.9 → 169.254.144.9 TCP 232 7991 → 22570 [ACK] Seq=32577 Ack=27577 Win=7192 Len=192
  126 0.009260049 169.254.145.9 → 169.254.144.9 TCP 40 7991 → 22570 [ACK] Seq=32769 Ack=28577 Win=6192 Len=0
  127 0.009283663 169.254.144.9 → 169.254.145.9 TCP 40 22570 → 7991 [ACK] Seq=32769 Ack=28577 Win=6192 Len=0
  128 0.009288191 169.254.144.9 → 169.254.145.9 TCP 40 22570 → 7991 [ACK] Seq=32769 Ack=29577 Win=7192 Len=0
  129 0.009301025 169.254.145.9 → 169.254.144.9 TCP 40 7991 → 22570 [ACK] Seq=32769 Ack=29577 Win=7192 Len=0
  130 0.009304682 169.254.145.9 → 169.254.144.9 TCP 40 7991 → 22570 [ACK] Seq=32769 Ack=30577 Win=6192 Len=0
  131 0.009327594 169.254.144.9 → 169.254.145.9 TCP 40 22570 → 7991 [ACK] Seq=32769 Ack=30577 Win=6192 Len=0
  132 0.009331882 169.254.144.9 → 169.254.145.9 TCP 40 22570 → 7991 [ACK] Seq=32769 Ack=31577 Win=7192 Len=0
  133 0.009346430 169.254.145.9 → 169.254.144.9 TCP 40 7991 → 22570 [ACK] Seq=32769 Ack=31577 Win=7192 Len=0
  134 0.009400881 169.254.145.9 → 169.254.144.9 TCP 40 7991 → 22570 [ACK] Seq=32769 Ack=32577 Win=6192 Len=0
  135 0.009515403 169.254.145.9 → 169.254.144.9 TCP 40 7991 → 22570 [ACK] Seq=32769 Ack=32769 Win=8000 Len=0
  136 0.009526633 169.254.144.9 → 169.254.145.9 TCP 40 22570 → 7991 [ACK] Seq=32769 Ack=32577 Win=6192 Len=0
  137 0.009553674 169.254.145.9 → 169.254.144.9 TCP 1040 7991 → 22570 [ACK] Seq=32769 Ack=32769 Win=8000 Len=1000
  138 0.009558773 169.254.145.9 → 169.254.144.9 TCP 1040 7991 → 22570 [ACK] Seq=33769 Ack=32769 Win=8000 Len=1000
  139 0.009601863 169.254.145.9 → 169.254.144.9 TCP 1040 7991 → 22570 [ACK] Seq=34769 Ack=32769 Win=8000 Len=1000
  140 0.009606592 169.254.145.9 → 169.254.144.9 TCP 1040 7991 → 22570 [ACK] Seq=35769 Ack=32769 Win=8000 Len=1000
  141 0.009627450 169.254.144.9 → 169.254.145.9 TCP 1040 22570 → 7991 [ACK] Seq=32769 Ack=32769 Win=8000 Len=1000
  142 0.009633491 169.254.144.9 → 169.254.145.9 TCP 1040 22570 → 7991 [ACK] Seq=33769 Ack=32769 Win=8000 Len=1000
  143 0.009653118 169.254.145.9 → 169.254.144.9 TCP 1040 7991 → 22570 [ACK] Seq=36769 Ack=32769 Win=8000 Len=1000
  144 0.009657587 169.254.145.9 → 169.254.144.9 TCP 1040 7991 → 22570 [ACK] Seq=37769 Ack=32769 Win=8000 Len=1000
  145 0.009683304 169.254.144.9 → 169.254.145.9 TCP 1040 22570 → 7991 [ACK] Seq=34769 Ack=32769 Win=8000 Len=1000
  146 0.009688664 169.254.144.9 → 169.254.145.9 TCP 1040 22570 → 7991 [ACK] Seq=35769 Ack=32769 Win=8000 Len=1000
  147 0.009702961 169.254.145.9 → 169.254.144.9 TCP 1040 7991 → 22570 [ACK] Seq=38769 Ack=33769 Win=7000 Len=1000
  148 0.009707499 169.254.145.9 → 169.254.144.9 TCP 1040 [TCP Window Full] 7991 → 22570 [ACK] Seq=39769 Ack=33769 Win=7000 Len=1000
  149 0.009711236 169.254.145.9 → 169.254.144.9 TCP 40 7991 → 22570 [ACK] Seq=40769 Ack=34769 Win=6000 Len=0
  150 0.009727225 169.254.144.9 → 169.254.145.9 TCP 1040 22570 → 7991 [ACK] Seq=36769 Ack=32769 Win=8000 Len=1000
  151 0.009732114 169.254.144.9 → 169.254.145.9 TCP 1040 22570 → 7991 [ACK] Seq=37769 Ack=32769 Win=8000 Len=1000
  152 0.009749126 169.254.145.9 → 169.254.144.9 TCP 40 7991 → 22570 [ACK] Seq=40769 Ack=35769 Win=5000 Len=0
  153 0.009752583 169.254.145.9 → 169.254.144.9 TCP 40 7991 → 22570 [ACK] Seq=40769 Ack=36769 Win=4000 Len=0
  154 0.009771297 169.254.144.9 → 169.254.145.9 TCP 1040 22570 → 7991 [ACK] Seq=38769 Ack=32769 Win=8000 Len=1000
  155 0.009776316 169.254.144.9 → 169.254.145.9 TCP 1040 [TCP Window Full] 22570 → 7991 [ACK] Seq=39769 Ack=32769 Win=8000 Len=1000
  156 0.009779722 169.254.144.9 → 169.254.145.9 TCP 40 22570 → 7991 [ACK] Seq=40769 Ack=33769 Win=7000 Len=0
  157 0.009790844 169.254.145.9 → 169.254.144.9 TCP 40 7991 → 22570 [ACK] Seq=40769 Ack=37769 Win=3000 Len=0
  158 0.009794180 169.254.145.9 → 169.254.144.9 TCP 40 7991 → 22570 [ACK] Seq=40769 Ack=38769 Win=2000 Len=0
  159 0.009817292 169.254.144.9 → 169.254.145.9 TCP 40 22570 → 7991 [ACK] Seq=40769 Ack=34769 Win=6000 Len=0
  160 0.009821340 169.254.144.9 → 169.254.145.9 TCP 40 22570 → 7991 [ACK] Seq=40769 Ack=35769 Win=5000 Len=0
  161 0.009832331 169.254.145.9 → 169.254.144.9 TCP 40 7991 → 22570 [ACK] Seq=40769 Ack=39769 Win=1000 Len=0
  162 0.009836458 169.254.145.9 → 169.254.144.9 TCP 40 [TCP ZeroWindow] 7991 → 22570 [ACK] Seq=40769 Ack=40769 Win=0 Len=0
  163 0.009863327 169.254.144.9 → 169.254.145.9 TCP 40 22570 → 7991 [ACK] Seq=40769 Ack=36769 Win=4000 Len=0
  164 0.009867375 169.254.144.9 → 169.254.145.9 TCP 40 22570 → 7991 [ACK] Seq=40769 Ack=37769 Win=3000 Len=0
  165 0.009904754 169.254.144.9 → 169.254.145.9 TCP 40 22570 → 7991 [ACK] Seq=40769 Ack=38769 Win=2000 Len=0
  166 0.009908672 169.254.144.9 → 169.254.145.9 TCP 40 22570 → 7991 [ACK] Seq=40769 Ack=39769 Win=1000 Len=0
  167 0.009945179 169.254.144.9 → 169.254.145.9 TCP 40 [TCP ZeroWindow] 22570 → 7991 [ACK] Seq=40769 Ack=40769 Win=0 Len=0
  168 0.010044574 169.254.144.9 → 169.254.145.9 TCP 41 [TCP ZeroWindowProbe] 22570 → 7991 [ACK] Seq=40769 Ack=40769 Win=0 Len=1
  169 0.010297383 169.254.145.9 → 169.254.144.9 TCP 41 [TCP ZeroWindowProbe] 7991 → 22570 [ACK] Seq=40769 Ack=40769 Win=0 Len=1
  170 0.010304195 169.254.145.9 → 169.254.144.9 TCP 40 [TCP ACKed unseen segment] [TCP Previous segment not captured] 7991 → 22570 [ACK] Seq=40770 Ack=40770 Win=8191 Len=0
  171 0.010729894 169.254.144.9 → 169.254.145.9 TCP 40 [TCP ZeroWindow] [TCP Previous segment not captured] 22570 → 7991 [ACK] Seq=40770 Ack=40769 Win=0 Len=0
  172 0.010757886 169.254.144.9 → 169.254.145.9 TCP 1040 22570 → 7991 [ACK] Seq=40770 Ack=40769 Win=8192 Len=1000
  173 0.010762695 169.254.144.9 → 169.254.145.9 TCP 1040 22570 → 7991 [ACK] Seq=41770 Ack=40769 Win=8192 Len=1000
  174 0.010766963 169.254.144.9 → 169.254.145.9 TCP 1040 22570 → 7991 [ACK] Seq=42770 Ack=40769 Win=8192 Len=1000
  175 0.010771411 169.254.144.9 → 169.254.145.9 TCP 1040 22570 → 7991 [ACK] Seq=43770 Ack=40769 Win=8192 Len=1000
  176 0.010775649 169.254.144.9 → 169.254.145.9 TCP 1040 22570 → 7991 [ACK] Seq=44770 Ack=40769 Win=8192 Len=1000
  177 0.010779827 169.254.144.9 → 169.254.145.9 TCP 1040 22570 → 7991 [ACK] Seq=45770 Ack=40769 Win=8192 Len=1000
  178 0.010783944 169.254.144.9 → 169.254.145.9 TCP 1040 22570 → 7991 [ACK] Seq=46770 Ack=40769 Win=8192 Len=1000
  179 0.010788102 169.254.144.9 → 169.254.145.9 TCP 1040 22570 → 7991 [ACK] Seq=47770 Ack=40769 Win=8192 Len=1000
  180 0.010792170 169.254.144.9 → 169.254.145.9 TCP 231 [TCP Window Full] 22570 → 7991 [ACK] Seq=48770 Ack=40769 Win=8192 Len=191
  181 0.011008661 169.254.145.9 → 169.254.144.9 TCP 1040 [TCP ACKed unseen segment] 7991 → 22570 [ACK] Seq=40770 Ack=41770 Win=7192 Len=1000
  182 0.011016465 169.254.145.9 → 169.254.144.9 TCP 1040 7991 → 22570 [ACK] Seq=41770 Ack=41770 Win=7192 Len=1000
  183 0.011020834 169.254.145.9 → 169.254.144.9 TCP 1040 7991 → 22570 [ACK] Seq=42770 Ack=41770 Win=7192 Len=1000
  184 0.011025162 169.254.145.9 → 169.254.144.9 TCP 1040 7991 → 22570 [ACK] Seq=43770 Ack=41770 Win=7192 Len=1000
  185 0.011029880 169.254.145.9 → 169.254.144.9 TCP 1040 7991 → 22570 [ACK] Seq=44770 Ack=41770 Win=7192 Len=1000
  186 0.011034108 169.254.145.9 → 169.254.144.9 TCP 1040 7991 → 22570 [ACK] Seq=45770 Ack=41770 Win=7192 Len=1000
  187 0.011038346 169.254.145.9 → 169.254.144.9 TCP 1040 7991 → 22570 [ACK] Seq=46770 Ack=41770 Win=7192 Len=1000
  188 0.011042614 169.254.145.9 → 169.254.144.9 TCP 1040 7991 → 22570 [ACK] Seq=47770 Ack=41770 Win=7192 Len=1000
  189 0.011046491 169.254.145.9 → 169.254.144.9 TCP 231 [TCP Window Full] 7991 → 22570 [ACK] Seq=48770 Ack=41770 Win=7192 Len=191
  190 0.011049917 169.254.145.9 → 169.254.144.9 TCP 40 7991 → 22570 [ACK] Seq=48961 Ack=42770 Win=6192 Len=0
  191 0.011102465 169.254.145.9 → 169.254.144.9 TCP 40 7991 → 22570 [ACK] Seq=48961 Ack=43770 Win=7192 Len=0
  192 0.011107144 169.254.145.9 → 169.254.144.9 TCP 40 7991 → 22570 [ACK] Seq=48961 Ack=44770 Win=6192 Len=0
  193 0.011148610 169.254.145.9 → 169.254.144.9 TCP 40 7991 → 22570 [ACK] Seq=48961 Ack=45770 Win=7192 Len=0
  194 0.011152247 169.254.145.9 → 169.254.144.9 TCP 40 7991 → 22570 [ACK] Seq=48961 Ack=46770 Win=6192 Len=0
  195 0.011190939 169.254.145.9 → 169.254.144.9 TCP 40 7991 → 22570 [ACK] Seq=48961 Ack=47770 Win=7192 Len=0
  196 0.011194626 169.254.145.9 → 169.254.144.9 TCP 40 7991 → 22570 [ACK] Seq=48961 Ack=48770 Win=6192 Len=0
  197 0.011219923 169.254.145.9 → 169.254.144.9 TCP 40 7991 → 22570 [ACK] Seq=48961 Ack=48961 Win=8001 Len=0
  198 0.011296084 169.254.144.9 → 169.254.145.9 TCP 41 22570 → 7991 [ACK] Seq=48961 Ack=40769 Win=8192 Len=1
  199 0.011317534 169.254.144.9 → 169.254.145.9 TCP 40 [TCP Dup ACK 167#1] 22570 → 7991 [ACK] Seq=48962 Ack=40769 Win=8192 Len=0
  200 0.011383526 169.254.144.9 → 169.254.145.9 TCP 40 [TCP Dup ACK 167#2] 22570 → 7991 [ACK] Seq=48962 Ack=40769 Win=8192 Len=0
  201 0.011390138 169.254.144.9 → 169.254.145.9 TCP 40 [TCP Dup ACK 167#3] 22570 → 7991 [ACK] Seq=48962 Ack=40769 Win=8192 Len=0
  202 0.011431104 169.254.144.9 → 169.254.145.9 TCP 40 [TCP Dup ACK 167#4] 22570 → 7991 [ACK] Seq=48962 Ack=40769 Win=8192 Len=0
  203 0.011435372 169.254.144.9 → 169.254.145.9 TCP 40 [TCP Dup ACK 167#5] 22570 → 7991 [ACK] Seq=48962 Ack=40769 Win=8192 Len=0
  204 0.011470507 169.254.144.9 → 169.254.145.9 TCP 40 [TCP Dup ACK 167#6] 22570 → 7991 [ACK] Seq=48962 Ack=40769 Win=8192 Len=0
  205 0.011474745 169.254.144.9 → 169.254.145.9 TCP 40 [TCP Dup ACK 167#7] 22570 → 7991 [ACK] Seq=48962 Ack=40769 Win=8192 Len=0
  206 0.011506574 169.254.144.9 → 169.254.145.9 TCP 40 [TCP Dup ACK 167#8] 22570 → 7991 [ACK] Seq=48962 Ack=40769 Win=8192 Len=0
  207 0.011543262 169.254.144.9 → 169.254.145.9 TCP 1040 22570 → 7991 [ACK] Seq=48962 Ack=40769 Win=8192 Len=1000
  208 0.011548532 169.254.144.9 → 169.254.145.9 TCP 1040 22570 → 7991 [ACK] Seq=49962 Ack=40769 Win=8192 Len=1000
  209 0.011550445 169.254.145.9 → 169.254.144.9 TCP 40 7991 → 22570 [ACK] Seq=48961 Ack=48962 Win=8191 Len=0
  210 0.011584258 169.254.144.9 → 169.254.145.9 TCP 1040 22570 → 7991 [ACK] Seq=50962 Ack=40769 Win=8192 Len=1000
  211 0.011589568 169.254.144.9 → 169.254.145.9 TCP 1040 22570 → 7991 [ACK] Seq=51962 Ack=40769 Win=8192 Len=1000
  212 0.011624643 169.254.144.9 → 169.254.145.9 TCP 1040 22570 → 7991 [ACK] Seq=52962 Ack=40769 Win=8192 Len=1000
  213 0.011629622 169.254.144.9 → 169.254.145.9 TCP 1040 22570 → 7991 [ACK] Seq=53962 Ack=40769 Win=8192 Len=1000
  214 0.011665589 169.254.144.9 → 169.254.145.9 TCP 1040 22570 → 7991 [ACK] Seq=54962 Ack=40769 Win=8192 Len=1000
  215 0.011670588 169.254.144.9 → 169.254.145.9 TCP 1040 22570 → 7991 [ACK] Seq=55962 Ack=40769 Win=8192 Len=1000
  216 0.011673995 169.254.144.9 → 169.254.145.9 TCP 231 [TCP Window Full] 22570 → 7991 [ACK] Seq=56962 Ack=40769 Win=8192 Len=191
  217 0.011758230 169.254.145.9 → 169.254.144.9 TCP 40 7991 → 22570 [ACK] Seq=48961 Ack=49962 Win=7192 Len=0
  218 0.011786102 169.254.145.9 → 169.254.144.9 TCP 40 7991 → 22570 [ACK] Seq=48961 Ack=50962 Win=6192 Len=0
  219 0.011850622 169.254.145.9 → 169.254.144.9 TCP 40 7991 → 22570 [ACK] Seq=48961 Ack=51962 Win=7192 Len=0
  220 0.011854308 169.254.145.9 → 169.254.144.9 TCP 40 7991 → 22570 [ACK] Seq=48961 Ack=52962 Win=6192 Len=0
  221 0.011856132 169.254.144.9 → 169.254.145.9 TCP 41 22570 → 7991 [ACK] Seq=57153 Ack=40769 Win=8192 Len=1
  222 0.011899262 169.254.144.9 → 169.254.145.9 TCP 1040 22570 → 7991 [ACK] Seq=57154 Ack=40769 Win=8192 Len=1000
  223 0.011905253 169.254.144.9 → 169.254.145.9 TCP 1040 [TCP Window Full] 22570 → 7991 [ACK] Seq=58154 Ack=40769 Win=8192 Len=1000
  224 0.011912416 169.254.145.9 → 169.254.144.9 TCP 40 7991 → 22570 [ACK] Seq=48961 Ack=53962 Win=7192 Len=0
  225 0.011922355 169.254.145.9 → 169.254.144.9 TCP 40 7991 → 22570 [ACK] Seq=48961 Ack=54962 Win=6192 Len=0
  226 0.011970764 169.254.145.9 → 169.254.144.9 TCP 40 7991 → 22570 [ACK] Seq=48961 Ack=55962 Win=7192 Len=0
  227 0.011974902 169.254.145.9 → 169.254.144.9 TCP 40 7991 → 22570 [ACK] Seq=48961 Ack=56962 Win=6192 Len=0
  228 0.012021058 169.254.145.9 → 169.254.144.9 TCP 40 7991 → 22570 [ACK] Seq=48961 Ack=57153 Win=8001 Len=0
  229 0.012024574 169.254.145.9 → 169.254.144.9 TCP 40 7991 → 22570 [ACK] Seq=48961 Ack=57154 Win=8000 Len=0
  230 0.012075368 169.254.145.9 → 169.254.144.9 TCP 40 7991 → 22570 [ACK] Seq=48961 Ack=58154 Win=7192 Len=0
  231 0.012078985 169.254.145.9 → 169.254.144.9 TCP 40 7991 → 22570 [ACK] Seq=48961 Ack=59154 Win=6192 Len=0
  232 0.012230836 169.254.144.9 → 169.254.145.9 TCP 1040 22570 → 7991 [ACK] Seq=59154 Ack=40769 Win=8192 Len=1000
  233 0.012262736 169.254.144.9 → 169.254.145.9 TCP 1040 22570 → 7991 [ACK] Seq=60154 Ack=40769 Win=8192 Len=1000
  234 0.012314231 169.254.144.9 → 169.254.145.9 TCP 1040 22570 → 7991 [ACK] Seq=61154 Ack=40769 Win=8192 Len=1000
  235 0.012319331 169.254.144.9 → 169.254.145.9 TCP 1040 22570 → 7991 [ACK] Seq=62154 Ack=40769 Win=8192 Len=1000
  236 0.012365636 169.254.144.9 → 169.254.145.9 TCP 1040 22570 → 7991 [ACK] Seq=63154 Ack=40769 Win=8192 Len=1000
  237 0.012376356 169.254.144.9 → 169.254.145.9 TCP 1040 22570 → 7991 [ACK] Seq=64154 Ack=40769 Win=8192 Len=1000
  238 0.012411853 169.254.145.9 → 169.254.144.9 TCP 40 7991 → 22570 [ACK] Seq=48961 Ack=60154 Win=7192 Len=0
  239 0.012416732 169.254.145.9 → 169.254.144.9 TCP 40 7991 → 22570 [ACK] Seq=48961 Ack=61154 Win=6192 Len=0
  240 0.012423023 169.254.144.9 → 169.254.145.9 TCP 232 22570 → 7991 [ACK] Seq=65154 Ack=40769 Win=8192 Len=192
  241 0.012459832 169.254.145.9 → 169.254.144.9 TCP 40 7991 → 22570 [ACK] Seq=48961 Ack=62154 Win=7192 Len=0
  242 0.012463349 169.254.145.9 → 169.254.144.9 TCP 40 7991 → 22570 [ACK] Seq=48961 Ack=63154 Win=6192 Len=0
  243 0.012463778 169.254.144.9 → 169.254.145.9 TCP 1040 22570 → 7991 [ACK] Seq=65346 Ack=40769 Win=8192 Len=1000
  244 0.012468868 169.254.144.9 → 169.254.145.9 TCP 1040 22570 → 7991 [ACK] Seq=66346 Ack=40769 Win=8192 Len=1000
  245 0.012511157 169.254.145.9 → 169.254.144.9 TCP 40 7991 → 22570 [ACK] Seq=48961 Ack=64154 Win=7192 Len=0
  246 0.012514684 169.254.145.9 → 169.254.144.9 TCP 40 7991 → 22570 [ACK] Seq=48961 Ack=65154 Win=6192 Len=0
  247 0.012553376 169.254.145.9 → 169.254.144.9 TCP 40 7991 → 22570 [ACK] Seq=48961 Ack=65346 Win=8000 Len=0
  248 0.012556832 169.254.145.9 → 169.254.144.9 TCP 40 7991 → 22570 [ACK] Seq=48961 Ack=66346 Win=7000 Len=0
  249 0.012578451 169.254.144.9 → 169.254.145.9 TCP 1040 22570 → 7991 [ACK] Seq=67346 Ack=40769 Win=8192 Len=1000
  250 0.012580786 169.254.145.9 → 169.254.144.9 TCP 40 7991 → 22570 [ACK] Seq=48961 Ack=67346 Win=7192 Len=0
  251 0.012591205 169.254.144.9 → 169.254.145.9 TCP 1040 22570 → 7991 [ACK] Seq=68346 Ack=40769 Win=8192 Len=1000
  252 0.012634555 169.254.144.9 → 169.254.145.9 TCP 1040 22570 → 7991 [ACK] Seq=69346 Ack=40769 Win=8192 Len=1000
  253 0.012640045 169.254.144.9 → 169.254.145.9 TCP 1040 22570 → 7991 [ACK] Seq=70346 Ack=40769 Win=8192 Len=1000
  254 0.012676102 169.254.144.9 → 169.254.145.9 TCP 1040 22570 → 7991 [ACK] Seq=71346 Ack=40769 Win=8192 Len=1000
  255 0.012681302 169.254.144.9 → 169.254.145.9 TCP 1040 22570 → 7991 [ACK] Seq=72346 Ack=40769 Win=8192 Len=1000
  256 0.012702531 169.254.144.9 → 169.254.145.9 TCP 1040 22570 → 7991 [ACK] Seq=73346 Ack=40769 Win=8192 Len=1000
  257 0.012707610 169.254.144.9 → 169.254.145.9 TCP 232 [TCP Window Full] 22570 → 7991 [ACK] Seq=74346 Ack=40769 Win=8192 Len=192
  258 0.012909655 169.254.145.9 → 169.254.144.9 TCP 40 7991 → 22570 [ACK] Seq=48961 Ack=68346 Win=7192 Len=0
  259 0.012919073 169.254.145.9 → 169.254.144.9 TCP 40 7991 → 22570 [ACK] Seq=48961 Ack=69346 Win=6192 Len=0
  260 0.012978633 169.254.145.9 → 169.254.144.9 TCP 40 7991 → 22570 [ACK] Seq=48961 Ack=70346 Win=7192 Len=0
  261 0.012982260 169.254.145.9 → 169.254.144.9 TCP 40 7991 → 22570 [ACK] Seq=48961 Ack=71346 Win=6192 Len=0
  262 0.013021613 169.254.145.9 → 169.254.144.9 TCP 40 7991 → 22570 [ACK] Seq=48961 Ack=72346 Win=7192 Len=0
  263 0.013025259 169.254.145.9 → 169.254.144.9 TCP 40 7991 → 22570 [ACK] Seq=48961 Ack=73346 Win=6192 Len=0
  264 0.013065654 169.254.145.9 → 169.254.144.9 TCP 40 7991 → 22570 [ACK] Seq=48961 Ack=74346 Win=7192 Len=0
  265 0.013069000 169.254.145.9 → 169.254.144.9 TCP 40 7991 → 22570 [ACK] Seq=48961 Ack=74538 Win=7000 Len=0
  266 0.013296162 169.254.144.9 → 169.254.145.9 TCP 1040 22570 → 7991 [ACK] Seq=74538 Ack=40769 Win=8192 Len=1000
  267 0.013409682 169.254.144.9 → 169.254.145.9 TCP 1040 22570 → 7991 [ACK] Seq=75538 Ack=40769 Win=8192 Len=1000
  268 0.013425291 169.254.144.9 → 169.254.145.9 TCP 1040 22570 → 7991 [ACK] Seq=76538 Ack=40769 Win=8192 Len=1000
  269 0.013461077 169.254.144.9 → 169.254.145.9 TCP 1040 22570 → 7991 [ACK] Seq=77538 Ack=40769 Win=8192 Len=1000
  270 0.013466568 169.254.144.9 → 169.254.145.9 TCP 1040 22570 → 7991 [ACK] Seq=78538 Ack=40769 Win=8192 Len=1000
  271 0.013499579 169.254.144.9 → 169.254.145.9 TCP 1040 22570 → 7991 [ACK] Seq=79538 Ack=40769 Win=8192 Len=1000
  272 0.013504799 169.254.144.9 → 169.254.145.9 TCP 1040 [TCP Window Full] 22570 → 7991 [ACK] Seq=80538 Ack=40769 Win=8192 Len=1000
  273 0.013594215 169.254.145.9 → 169.254.144.9 TCP 40 7991 → 22570 [ACK] Seq=48961 Ack=75538 Win=7192 Len=0
  274 0.013602501 169.254.145.9 → 169.254.144.9 TCP 40 7991 → 22570 [ACK] Seq=48961 Ack=76538 Win=6192 Len=0
  275 0.013692167 169.254.145.9 → 169.254.144.9 TCP 40 7991 → 22570 [ACK] Seq=48961 Ack=77538 Win=7192 Len=0
  276 0.013696355 169.254.145.9 → 169.254.144.9 TCP 40 7991 → 22570 [ACK] Seq=48961 Ack=78538 Win=6192 Len=0
  277 0.013737331 169.254.145.9 → 169.254.144.9 TCP 40 7991 → 22570 [ACK] Seq=48961 Ack=79538 Win=7192 Len=0
  278 0.013741018 169.254.145.9 → 169.254.144.9 TCP 40 7991 → 22570 [ACK] Seq=48961 Ack=80538 Win=6192 Len=0
  279 0.013764792 169.254.145.9 → 169.254.144.9 TCP 40 7991 → 22570 [ACK] Seq=48961 Ack=81538 Win=7192 Len=0
  280 0.013926942 169.254.144.9 → 169.254.145.9 TCP 1040 22570 → 7991 [ACK] Seq=81538 Ack=40769 Win=8192 Len=1000
  281 0.013993175 169.254.144.9 → 169.254.145.9 TCP 232 22570 → 7991 [ACK] Seq=82538 Ack=40769 Win=8192 Len=192
  282 0.014055801 169.254.144.9 → 169.254.145.9 TCP 1040 22570 → 7991 [ACK] Seq=82730 Ack=40769 Win=8192 Len=1000
  283 0.014060961 169.254.144.9 → 169.254.145.9 TCP 1040 22570 → 7991 [ACK] Seq=83730 Ack=40769 Win=8192 Len=1000
  284 0.014095004 169.254.144.9 → 169.254.145.9 TCP 1040 22570 → 7991 [ACK] Seq=84730 Ack=40769 Win=8192 Len=1000
  285 0.014100264 169.254.144.9 → 169.254.145.9 TCP 1040 22570 → 7991 [ACK] Seq=85730 Ack=40769 Win=8192 Len=1000
  286 0.014120992 169.254.144.9 → 169.254.145.9 TCP 1040 22570 → 7991 [ACK] Seq=86730 Ack=40769 Win=8192 Len=1000
  287 0.014125791 169.254.144.9 → 169.254.145.9 TCP 1040 [TCP Window Full] 22570 → 7991 [ACK] Seq=87730 Ack=40769 Win=8192 Len=1000
  288 0.014136019 169.254.145.9 → 169.254.144.9 TCP 40 7991 → 22570 [ACK] Seq=48961 Ack=82538 Win=7192 Len=0
  289 0.014145276 169.254.145.9 → 169.254.144.9 TCP 40 7991 → 22570 [ACK] Seq=48961 Ack=82730 Win=7000 Len=0
  290 0.014190189 169.254.145.9 → 169.254.144.9 TCP 40 7991 → 22570 [ACK] Seq=48961 Ack=83730 Win=7192 Len=0
  291 0.014193616 169.254.145.9 → 169.254.144.9 TCP 40 7991 → 22570 [ACK] Seq=48961 Ack=84730 Win=6192 Len=0
  292 0.014210358 169.254.144.9 → 169.254.145.9 TCP 1040 22570 → 7991 [ACK] Seq=88730 Ack=40769 Win=8192 Len=1000
  293 0.014233460 169.254.145.9 → 169.254.144.9 TCP 40 7991 → 22570 [ACK] Seq=48961 Ack=85730 Win=7192 Len=0
  294 0.014237116 169.254.145.9 → 169.254.144.9 TCP 40 7991 → 22570 [ACK] Seq=48961 Ack=86730 Win=6192 Len=0
  295 0.014247657 169.254.144.9 → 169.254.145.9 TCP 1040 22570 → 7991 [ACK] Seq=89730 Ack=40769 Win=8192 Len=1000
  296 0.014252095 169.254.144.9 → 169.254.145.9 TCP 232 22570 → 7991 [ACK] Seq=90730 Ack=40769 Win=8192 Len=192
  297 0.014276259 169.254.145.9 → 169.254.144.9 TCP 40 7991 → 22570 [ACK] Seq=48961 Ack=87730 Win=7192 Len=0
  298 0.014279695 169.254.145.9 → 169.254.144.9 TCP 40 7991 → 22570 [ACK] Seq=48961 Ack=88730 Win=6192 Len=0
  299 0.014285407 169.254.144.9 → 169.254.145.9 TCP 1040 22570 → 7991 [ACK] Seq=90922 Ack=40769 Win=8192 Len=1000
  300 0.014290156 169.254.144.9 → 169.254.145.9 TCP 1040 22570 → 7991 [ACK] Seq=91922 Ack=40769 Win=8192 Len=1000
  301 0.014318898 169.254.145.9 → 169.254.144.9 TCP 40 7991 → 22570 [ACK] Seq=48961 Ack=89730 Win=7192 Len=0
  302 0.014322374 169.254.145.9 → 169.254.144.9 TCP 40 7991 → 22570 [ACK] Seq=48961 Ack=90730 Win=6192 Len=0
  303 0.014323578 169.254.144.9 → 169.254.145.9 TCP 1040 22570 → 7991 [ACK] Seq=92922 Ack=40769 Win=8192 Len=1000
  304 0.014328847 169.254.144.9 → 169.254.145.9 TCP 1040 22570 → 7991 [ACK] Seq=93922 Ack=40769 Win=8192 Len=1000
  305 0.014383297 169.254.145.9 → 169.254.144.9 TCP 40 7991 → 22570 [ACK] Seq=48961 Ack=90922 Win=8000 Len=0
  306 0.014389819 169.254.145.9 → 169.254.144.9 TCP 40 7991 → 22570 [ACK] Seq=48961 Ack=91922 Win=7000 Len=0
  307 0.014413074 169.254.144.9 → 169.254.145.9 TCP 1040 22570 → 7991 [ACK] Seq=94922 Ack=40769 Win=8192 Len=1000
  308 0.014423804 169.254.144.9 → 169.254.145.9 TCP 1040 22570 → 7991 [ACK] Seq=95922 Ack=40769 Win=8192 Len=1000
  309 0.014467635 169.254.144.9 → 169.254.145.9 TCP 1040 22570 → 7991 [ACK] Seq=96922 Ack=40769 Win=8192 Len=1000
  310 0.014472684 169.254.144.9 → 169.254.145.9 TCP 1040 [TCP Window Full] 22570 → 7991 [ACK] Seq=97922 Ack=40769 Win=8192 Len=1000
  311 0.014492931 169.254.145.9 → 169.254.144.9 TCP 40 7991 → 22570 [ACK] Seq=48961 Ack=92922 Win=7192 Len=0
  312 0.014530831 169.254.145.9 → 169.254.144.9 TCP 40 7991 → 22570 [ACK] Seq=48961 Ack=93922 Win=6192 Len=0
  313 0.014626949 169.254.145.9 → 169.254.144.9 TCP 40 7991 → 22570 [ACK] Seq=48961 Ack=94922 Win=7192 Len=0
  314 0.014630406 169.254.145.9 → 169.254.144.9 TCP 40 7991 → 22570 [ACK] Seq=48961 Ack=95922 Win=6192 Len=0
  315 0.014658549 169.254.144.9 → 169.254.145.9 TCP 1040 22570 → 7991 [ACK] Seq=98922 Ack=40769 Win=8192 Len=1000
  316 0.014670209 169.254.145.9 → 169.254.144.9 TCP 40 7991 → 22570 [ACK] Seq=48961 Ack=96922 Win=7192 Len=0
  317 0.014673226 169.254.144.9 → 169.254.145.9 TCP 232 22570 → 7991 [ACK] Seq=99922 Ack=40769 Win=8192 Len=192
  318 0.014673716 169.254.145.9 → 169.254.144.9 TCP 40 7991 → 22570 [ACK] Seq=48961 Ack=97922 Win=6192 Len=0
  319 0.014716957 169.254.144.9 → 169.254.145.9 TCP 1040 22570 → 7991 [ACK] Seq=100114 Ack=40769 Win=8192 Len=1000
  320 0.014719881 169.254.145.9 → 169.254.144.9 TCP 40 7991 → 22570 [ACK] Seq=48961 Ack=98922 Win=7192 Len=0
  321 0.014722507 169.254.144.9 → 169.254.145.9 TCP 1040 22570 → 7991 [ACK] Seq=101114 Ack=40769 Win=8192 Len=1000
  322 0.014723468 169.254.145.9 → 169.254.144.9 TCP 40 7991 → 22570 [ACK] Seq=48961 Ack=99922 Win=6192 Len=0
  323 0.014762411 169.254.144.9 → 169.254.145.9 TCP 1040 22570 → 7991 [ACK] Seq=102114 Ack=40769 Win=8192 Len=1000
  324 0.014767381 169.254.144.9 → 169.254.145.9 TCP 1040 22570 → 7991 [ACK] Seq=103114 Ack=40769 Win=8192 Len=1000
  325 0.014768612 169.254.145.9 → 169.254.144.9 TCP 40 7991 → 22570 [ACK] Seq=48961 Ack=100114 Win=8000 Len=0
  326 0.014772068 169.254.145.9 → 169.254.144.9 TCP 40 7991 → 22570 [ACK] Seq=48961 Ack=101114 Win=7000 Len=0
  327 0.014801394 169.254.144.9 → 169.254.145.9 TCP 1040 22570 → 7991 [ACK] Seq=104114 Ack=40769 Win=8192 Len=1000
  328 0.014806323 169.254.144.9 → 169.254.145.9 TCP 1040 22570 → 7991 [ACK] Seq=105114 Ack=40769 Win=8192 Len=1000
  329 0.014811812 169.254.145.9 → 169.254.144.9 TCP 40 7991 → 22570 [ACK] Seq=48961 Ack=102114 Win=7192 Len=0
  330 0.014815358 169.254.145.9 → 169.254.144.9 TCP 40 7991 → 22570 [ACK] Seq=48961 Ack=103114 Win=6192 Len=0
  331 0.014839715 169.254.144.9 → 169.254.145.9 TCP 1040 22570 → 7991 [ACK] Seq=106114 Ack=40769 Win=8192 Len=1000
  332 0.014844654 169.254.144.9 → 169.254.145.9 TCP 1040 22570 → 7991 [ACK] Seq=107114 Ack=40769 Win=8192 Len=1000
  333 0.014854190 169.254.145.9 → 169.254.144.9 TCP 40 7991 → 22570 [ACK] Seq=48961 Ack=104114 Win=7192 Len=0
  334 0.014857547 169.254.145.9 → 169.254.144.9 TCP 40 7991 → 22570 [ACK] Seq=48961 Ack=105114 Win=6192 Len=0
  335 0.014877535 169.254.144.9 → 169.254.145.9 TCP 1040 22570 → 7991 [ACK] Seq=108114 Ack=40769 Win=8192 Len=1000
  336 0.014881883 169.254.144.9 → 169.254.145.9 TCP 232 22570 → 7991 [ACK] Seq=109114 Ack=40769 Win=8192 Len=192
  337 0.014896369 169.254.145.9 → 169.254.144.9 TCP 40 7991 → 22570 [ACK] Seq=48961 Ack=106114 Win=7192 Len=0
  338 0.014899975 169.254.145.9 → 169.254.144.9 TCP 40 7991 → 22570 [ACK] Seq=48961 Ack=107114 Win=6192 Len=0
  339 0.014915766 169.254.144.9 → 169.254.145.9 TCP 1040 22570 → 7991 [ACK] Seq=109306 Ack=40769 Win=8192 Len=1000
  340 0.014920585 169.254.144.9 → 169.254.145.9 TCP 1040 22570 → 7991 [ACK] Seq=110306 Ack=40769 Win=8192 Len=1000
  341 0.014938577 169.254.145.9 → 169.254.144.9 TCP 40 7991 → 22570 [ACK] Seq=48961 Ack=108114 Win=7192 Len=0
  342 0.014942103 169.254.145.9 → 169.254.144.9 TCP 40 7991 → 22570 [ACK] Seq=48961 Ack=109114 Win=6192 Len=0
  343 0.014953736 169.254.144.9 → 169.254.145.9 TCP 1040 22570 → 7991 [ACK] Seq=111306 Ack=40769 Win=8192 Len=1000
  344 0.014958705 169.254.144.9 → 169.254.145.9 TCP 1040 22570 → 7991 [ACK] Seq=112306 Ack=40769 Win=8192 Len=1000
  345 0.014979583 169.254.145.9 → 169.254.144.9 TCP 40 7991 → 22570 [ACK] Seq=48961 Ack=109306 Win=8000 Len=0
  346 0.014983009 169.254.145.9 → 169.254.144.9 TCP 40 7991 → 22570 [ACK] Seq=48961 Ack=110306 Win=7000 Len=0
  347 0.014992047 169.254.144.9 → 169.254.145.9 TCP 1040 22570 → 7991 [ACK] Seq=113306 Ack=40769 Win=8192 Len=1000
  348 0.014997187 169.254.144.9 → 169.254.145.9 TCP 1040 22570 → 7991 [ACK] Seq=114306 Ack=40769 Win=8192 Len=1000
  349 0.015022052 169.254.145.9 → 169.254.144.9 TCP 40 7991 → 22570 [ACK] Seq=48961 Ack=111306 Win=7192 Len=0
  350 0.015025598 169.254.145.9 → 169.254.144.9 TCP 40 7991 → 22570 [ACK] Seq=48961 Ack=112306 Win=6192 Len=0
  351 0.015030539 169.254.144.9 → 169.254.145.9 TCP 1040 22570 → 7991 [ACK] Seq=115306 Ack=40769 Win=8192 Len=1000
  352 0.015035398 169.254.144.9 → 169.254.145.9 TCP 1040 22570 → 7991 [ACK] Seq=116306 Ack=40769 Win=8192 Len=1000
  353 0.015065212 169.254.145.9 → 169.254.144.9 TCP 40 7991 → 22570 [ACK] Seq=48961 Ack=113306 Win=7192 Len=0
  354 0.015068579 169.254.144.9 → 169.254.145.9 TCP 1040 22570 → 7991 [ACK] Seq=117306 Ack=40769 Win=8192 Len=1000
  355 0.015068688 169.254.145.9 → 169.254.144.9 TCP 40 7991 → 22570 [ACK] Seq=48961 Ack=114306 Win=6192 Len=0
  356 0.015073117 169.254.144.9 → 169.254.145.9 TCP 232 22570 → 7991 [ACK] Seq=118306 Ack=40769 Win=8192 Len=192
  357 0.015106199 169.254.144.9 → 169.254.145.9 TCP 1040 22570 → 7991 [ACK] Seq=118498 Ack=40769 Win=8192 Len=1000
  358 0.015107360 169.254.145.9 → 169.254.144.9 TCP 40 7991 → 22570 [ACK] Seq=48961 Ack=115306 Win=7192 Len=0
  359 0.015110696 169.254.145.9 → 169.254.144.9 TCP 40 7991 → 22570 [ACK] Seq=48961 Ack=116306 Win=6192 Len=0
  360 0.015111038 169.254.144.9 → 169.254.145.9 TCP 1040 22570 → 7991 [ACK] Seq=119498 Ack=40769 Win=8192 Len=1000
  361 0.015144370 169.254.144.9 → 169.254.145.9 TCP 1040 22570 → 7991 [ACK] Seq=120498 Ack=40769 Win=8192 Len=1000
  362 0.015149770 169.254.144.9 → 169.254.145.9 TCP 1040 [TCP Window Full] 22570 → 7991 [ACK] Seq=121498 Ack=40769 Win=8192 Len=1000
  363 0.015150420 169.254.145.9 → 169.254.144.9 TCP 40 7991 → 22570 [ACK] Seq=48961 Ack=117306 Win=7192 Len=0
  364 0.015154718 169.254.145.9 → 169.254.144.9 TCP 40 7991 → 22570 [ACK] Seq=48961 Ack=118306 Win=6192 Len=0
  365 0.015185546 169.254.144.9 → 169.254.145.9 TCP 1040 22570 → 7991 [ACK] Seq=122498 Ack=40769 Win=8192 Len=1000
  366 0.015190455 169.254.144.9 → 169.254.145.9 TCP 1040 [TCP Window Full] 22570 → 7991 [ACK] Seq=123498 Ack=40769 Win=8192 Len=1000
  367 0.015194361 169.254.145.9 → 169.254.144.9 TCP 40 7991 → 22570 [ACK] Seq=48961 Ack=118498 Win=8000 Len=0
  368 0.015205692 169.254.145.9 → 169.254.144.9 TCP 40 7991 → 22570 [ACK] Seq=48961 Ack=119498 Win=7000 Len=0
  369 0.015244945 169.254.145.9 → 169.254.144.9 TCP 40 7991 → 22570 [ACK] Seq=48961 Ack=120498 Win=7192 Len=0
  370 0.015248381 169.254.145.9 → 169.254.144.9 TCP 40 7991 → 22570 [ACK] Seq=48961 Ack=121498 Win=6192 Len=0
  371 0.015287023 169.254.145.9 → 169.254.144.9 TCP 40 7991 → 22570 [ACK] Seq=48961 Ack=122498 Win=7192 Len=0
  372 0.015290970 169.254.145.9 → 169.254.144.9 TCP 40 7991 → 22570 [ACK] Seq=48961 Ack=123498 Win=6192 Len=0
  373 0.015302483 169.254.144.9 → 169.254.145.9 TCP 1040 22570 → 7991 [ACK] Seq=124498 Ack=40769 Win=8192 Len=1000
  374 0.015312721 169.254.145.9 → 169.254.144.9 TCP 40 7991 → 22570 [ACK] Seq=48961 Ack=124498 Win=7192 Len=0
  375 0.015313944 169.254.144.9 → 169.254.145.9 TCP 1040 22570 → 7991 [ACK] Seq=125498 Ack=40769 Win=8192 Len=1000
  376 0.015349849 169.254.145.9 → 169.254.144.9 TCP 40 7991 → 22570 [ACK] Seq=48961 Ack=125498 Win=6192 Len=0
  377 0.015353476 169.254.145.9 → 169.254.144.9 TCP 40 7991 → 22570 [ACK] Seq=48961 Ack=126498 Win=5192 Len=0
  378 0.015376430 169.254.144.9 → 169.254.145.9 TCP 1040 22570 → 7991 [ACK] Seq=126498 Ack=40769 Win=8192 Len=1000
  379 0.015387440 169.254.144.9 → 169.254.145.9 TCP 232 22570 → 7991 [ACK] Seq=127498 Ack=40769 Win=8192 Len=192
  380 0.015446380 169.254.144.9 → 169.254.145.9 TCP 1040 22570 → 7991 [ACK] Seq=127690 Ack=40769 Win=8192 Len=1000
  381 0.015451629 169.254.144.9 → 169.254.145.9 TCP 1040 22570 → 7991 [ACK] Seq=128690 Ack=40769 Win=8192 Len=1000
  382 0.015485903 169.254.144.9 → 169.254.145.9 TCP 1040 22570 → 7991 [ACK] Seq=129690 Ack=40769 Win=8192 Len=1000
  383 0.015490531 169.254.144.9 → 169.254.145.9 TCP 423 22570 → 7991 [FIN, ACK] Seq=130690 Ack=40769 Win=8192 Len=383
  384 0.015713094 169.254.145.9 → 169.254.144.9 TCP 40 7991 → 22570 [ACK] Seq=48961 Ack=127498 Win=4192 Len=0
  385 0.015722281 169.254.145.9 → 169.254.144.9 TCP 40 7991 → 22570 [ACK] Seq=48961 Ack=127690 Win=8000 Len=0
  386 0.015796719 169.254.145.9 → 169.254.144.9 TCP 40 7991 → 22570 [ACK] Seq=48961 Ack=128690 Win=7000 Len=0
  387 0.015801087 169.254.145.9 → 169.254.144.9 TCP 40 7991 → 22570 [ACK] Seq=48961 Ack=129690 Win=7192 Len=0
  388 0.015842574 169.254.145.9 → 169.254.144.9 TCP 40 7991 → 22570 [ACK] Seq=48961 Ack=130690 Win=6192 Len=0
  389 0.015847704 169.254.145.9 → 169.254.144.9 TCP 40 7991 → 22570 [ACK] Seq=48961 Ack=131074 Win=7809 Len=0
  390 0.021190340 169.254.145.9 → 169.254.144.9 TCP 41 [TCP Fast Retransmission] 7991 → 22570 [ACK] Seq=40769 Ack=131074 Win=8192 Len=1
  391 0.022653542 169.254.144.9 → 169.254.145.9 TCP 40 [TCP ZeroWindow] 22570 → 7991 [ACK] Seq=131074 Ack=48961 Win=0 Len=0
  392 0.022926940 169.254.145.9 → 169.254.144.9 TCP 41 [TCP ZeroWindowProbe] 7991 → 22570 [ACK] Seq=48961 Ack=131074 Win=8192 Len=1
  393 0.023433942 169.254.144.9 → 169.254.145.9 TCP 40 [TCP ACKed unseen segment] 22570 → 7991 [ACK] Seq=131074 Ack=48962 Win=8191 Len=0
  394 0.023659749 169.254.145.9 → 169.254.144.9 TCP 1040 [TCP Previous segment not captured] 7991 → 22570 [ACK] Seq=48962 Ack=131074 Win=8192 Len=1000
  395 0.023684555 169.254.145.9 → 169.254.144.9 TCP 1040 7991 → 22570 [ACK] Seq=49962 Ack=131074 Win=8192 Len=1000
  396 0.023689724 169.254.145.9 → 169.254.144.9 TCP 1040 7991 → 22570 [ACK] Seq=50962 Ack=131074 Win=8192 Len=1000
  397 0.023695094 169.254.145.9 → 169.254.144.9 TCP 1040 7991 → 22570 [ACK] Seq=51962 Ack=131074 Win=8192 Len=1000
  398 0.023699623 169.254.145.9 → 169.254.144.9 TCP 1040 7991 → 22570 [ACK] Seq=52962 Ack=131074 Win=8192 Len=1000
  399 0.023704251 169.254.145.9 → 169.254.144.9 TCP 1040 7991 → 22570 [ACK] Seq=53962 Ack=131074 Win=8192 Len=1000
  400 0.023709270 169.254.145.9 → 169.254.144.9 TCP 1040 7991 → 22570 [ACK] Seq=54962 Ack=131074 Win=8192 Len=1000
  401 0.023714881 169.254.145.9 → 169.254.144.9 TCP 1040 7991 → 22570 [ACK] Seq=55962 Ack=131074 Win=8192 Len=1000
  402 0.023719519 169.254.145.9 → 169.254.144.9 TCP 231 [TCP Window Full] 7991 → 22570 [ACK] Seq=56962 Ack=131074 Win=8192 Len=191
  403 0.024124563 169.254.144.9 → 169.254.145.9 TCP 40 [TCP ACKed unseen segment] 22570 → 7991 [ACK] Seq=131074 Ack=49962 Win=7192 Len=0
  404 0.024141204 169.254.144.9 → 169.254.145.9 TCP 40 22570 → 7991 [ACK] Seq=131074 Ack=50962 Win=6192 Len=0
  405 0.024317919 169.254.145.9 → 169.254.144.9 TCP 41 [TCP Window Full] 7991 → 22570 [ACK] Seq=57153 Ack=131074 Win=8192 Len=1
  406 0.024324864 169.254.144.9 → 169.254.145.9 TCP 40 22570 → 7991 [ACK] Seq=131074 Ack=51962 Win=7192 Len=0
  407 0.024331056 169.254.144.9 → 169.254.145.9 TCP 40 22570 → 7991 [ACK] Seq=131074 Ack=52962 Win=6192 Len=0
  408 0.024425007 169.254.145.9 → 169.254.144.9 TCP 1040 7991 → 22570 [ACK] Seq=57154 Ack=131074 Win=8192 Len=1000
  409 0.024430327 169.254.145.9 → 169.254.144.9 TCP 1040 [TCP Window Full] 7991 → 22570 [ACK] Seq=58154 Ack=131074 Win=8192 Len=1000
  410 0.024539332 169.254.144.9 → 169.254.145.9 TCP 40 22570 → 7991 [ACK] Seq=131074 Ack=53962 Win=7192 Len=0
  411 0.024547296 169.254.144.9 → 169.254.145.9 TCP 40 22570 → 7991 [ACK] Seq=131074 Ack=54962 Win=6192 Len=0
  412 0.024622874 169.254.145.9 → 169.254.144.9 TCP 1040 7991 → 22570 [ACK] Seq=59154 Ack=131074 Win=8192 Len=1000
  413 0.024627543 169.254.145.9 → 169.254.144.9 TCP 1040 [TCP Window Full] 7991 → 22570 [ACK] Seq=60154 Ack=131074 Win=8192 Len=1000
  414 0.024676145 169.254.144.9 → 169.254.145.9 TCP 40 22570 → 7991 [ACK] Seq=131074 Ack=55962 Win=7192 Len=0
  415 0.024681686 169.254.144.9 → 169.254.145.9 TCP 40 22570 → 7991 [ACK] Seq=131074 Ack=56962 Win=6192 Len=0
  416 0.024750050 169.254.145.9 → 169.254.144.9 TCP 1040 7991 → 22570 [ACK] Seq=61154 Ack=131074 Win=8192 Len=1000
  417 0.024755130 169.254.145.9 → 169.254.144.9 TCP 1040 [TCP Window Full] 7991 → 22570 [ACK] Seq=62154 Ack=131074 Win=8192 Len=1000
  418 0.024797550 169.254.144.9 → 169.254.145.9 TCP 40 22570 → 7991 [ACK] Seq=131074 Ack=57153 Win=8001 Len=0
  419 0.024802209 169.254.144.9 → 169.254.145.9 TCP 40 22570 → 7991 [ACK] Seq=131074 Ack=57154 Win=8000 Len=0
  420 0.024870163 169.254.145.9 → 169.254.144.9 TCP 1040 7991 → 22570 [ACK] Seq=63154 Ack=131074 Win=8192 Len=1000
  421 0.024874872 169.254.145.9 → 169.254.144.9 TCP 1040 [TCP Window Full] 7991 → 22570 [ACK] Seq=64154 Ack=131074 Win=8192 Len=1000
  422 0.024919957 169.254.144.9 → 169.254.145.9 TCP 40 22570 → 7991 [ACK] Seq=131074 Ack=58154 Win=7192 Len=0
  423 0.024925087 169.254.144.9 → 169.254.145.9 TCP 40 22570 → 7991 [ACK] Seq=131074 Ack=59154 Win=6192 Len=0
  424 0.025010042 169.254.145.9 → 169.254.144.9 TCP 232 [TCP Window Full] 7991 → 22570 [ACK] Seq=65154 Ack=131074 Win=8192 Len=192
  425 0.025054787 169.254.144.9 → 169.254.145.9 TCP 40 22570 → 7991 [ACK] Seq=131074 Ack=60154 Win=7192 Len=0
  426 0.025060197 169.254.144.9 → 169.254.145.9 TCP 40 22570 → 7991 [ACK] Seq=131074 Ack=61154 Win=6192 Len=0
  427 0.025132670 169.254.145.9 → 169.254.144.9 TCP 1040 7991 → 22570 [ACK] Seq=65346 Ack=131074 Win=8192 Len=1000
  428 0.025138290 169.254.145.9 → 169.254.144.9 TCP 1040 [TCP Window Full] 7991 → 22570 [ACK] Seq=66346 Ack=131074 Win=8192 Len=1000
  429 0.025192413 169.254.144.9 → 169.254.145.9 TCP 40 22570 → 7991 [ACK] Seq=131074 Ack=62154 Win=7192 Len=0
  430 0.025197783 169.254.144.9 → 169.254.145.9 TCP 40 22570 → 7991 [ACK] Seq=131074 Ack=63154 Win=6192 Len=0
  431 0.025630174 169.254.144.9 → 169.254.145.9 TCP 40 22570 → 7991 [ACK] Seq=131074 Ack=64154 Win=7192 Len=0
  432 0.025668155 169.254.144.9 → 169.254.145.9 TCP 40 22570 → 7991 [ACK] Seq=131074 Ack=65154 Win=6192 Len=0
  433 0.026078766 169.254.144.9 → 169.254.145.9 TCP 40 22570 → 7991 [ACK] Seq=131074 Ack=65346 Win=8000 Len=0
  434 0.026093042 169.254.144.9 → 169.254.145.9 TCP 40 22570 → 7991 [ACK] Seq=131074 Ack=66346 Win=7000 Len=0
  435 0.026092088 169.254.145.9 → 169.254.144.9 TCP 1040 7991 → 22570 [ACK] Seq=67346 Ack=131074 Win=8192 Len=1000
  436 0.026101336 169.254.145.9 → 169.254.144.9 TCP 1040 7991 → 22570 [ACK] Seq=68346 Ack=131074 Win=8192 Len=1000
  437 0.026277632 169.254.145.9 → 169.254.144.9 TCP 1040 7991 → 22570 [ACK] Seq=69346 Ack=131074 Win=8192 Len=1000
  438 0.026282351 169.254.145.9 → 169.254.144.9 TCP 1040 7991 → 22570 [ACK] Seq=70346 Ack=131074 Win=8192 Len=1000
  439 0.026318869 169.254.145.9 → 169.254.144.9 TCP 1040 7991 → 22570 [ACK] Seq=71346 Ack=131074 Win=8192 Len=1000
  440 0.026324199 169.254.145.9 → 169.254.144.9 TCP 1040 [TCP Window Full] 7991 → 22570 [ACK] Seq=72346 Ack=131074 Win=8192 Len=1000
  441 0.026331745 169.254.144.9 → 169.254.145.9 TCP 40 22570 → 7991 [ACK] Seq=131074 Ack=67346 Win=7192 Len=0
  442 0.026340050 169.254.144.9 → 169.254.145.9 TCP 40 22570 → 7991 [ACK] Seq=131074 Ack=68346 Win=6192 Len=0
  443 0.026479417 169.254.145.9 → 169.254.144.9 TCP 1040 7991 → 22570 [ACK] Seq=73346 Ack=131074 Win=8192 Len=1000
  444 0.026487171 169.254.145.9 → 169.254.144.9 TCP 232 [TCP Window Full] 7991 → 22570 [ACK] Seq=74346 Ack=131074 Win=8192 Len=192
  445 0.026719584 169.254.144.9 → 169.254.145.9 TCP 40 22570 → 7991 [ACK] Seq=131074 Ack=69346 Win=7192 Len=0
  446 0.026731326 169.254.144.9 → 169.254.145.9 TCP 40 22570 → 7991 [ACK] Seq=131074 Ack=70346 Win=6192 Len=0
  447 0.026833253 169.254.145.9 → 169.254.144.9 TCP 1040 7991 → 22570 [ACK] Seq=74538 Ack=131074 Win=8192 Len=1000
  448 0.026838152 169.254.145.9 → 169.254.144.9 TCP 1040 [TCP Window Full] 7991 → 22570 [ACK] Seq=75538 Ack=131074 Win=8192 Len=1000
  449 0.026973986 169.254.144.9 → 169.254.145.9 TCP 40 22570 → 7991 [ACK] Seq=131074 Ack=71346 Win=7192 Len=0
  450 0.026983744 169.254.144.9 → 169.254.145.9 TCP 40 22570 → 7991 [ACK] Seq=131074 Ack=72346 Win=6192 Len=0
  451 0.027105437 169.254.145.9 → 169.254.144.9 TCP 1040 7991 → 22570 [ACK] Seq=76538 Ack=131074 Win=8192 Len=1000
  452 0.027111108 169.254.145.9 → 169.254.144.9 TCP 1040 [TCP Window Full] 7991 → 22570 [ACK] Seq=77538 Ack=131074 Win=8192 Len=1000
  453 0.027513336 169.254.144.9 → 169.254.145.9 TCP 40 22570 → 7991 [ACK] Seq=131074 Ack=73346 Win=7192 Len=0
  454 0.027555384 169.254.144.9 → 169.254.145.9 TCP 40 22570 → 7991 [ACK] Seq=131074 Ack=74346 Win=6192 Len=0
  455 0.027859496 169.254.145.9 → 169.254.144.9 TCP 1040 7991 → 22570 [ACK] Seq=78538 Ack=131074 Win=8192 Len=1000
  456 0.027866438 169.254.145.9 → 169.254.144.9 TCP 1040 [TCP Window Full] 7991 → 22570 [ACK] Seq=79538 Ack=131074 Win=8192 Len=1000
  457 0.028226849 169.254.144.9 → 169.254.145.9 TCP 40 22570 → 7991 [ACK] Seq=131074 Ack=74538 Win=8000 Len=0
  458 0.028244632 169.254.144.9 → 169.254.145.9 TCP 40 22570 → 7991 [ACK] Seq=131074 Ack=75538 Win=7000 Len=0
  459 0.028839052 169.254.145.9 → 169.254.144.9 TCP 1040 7991 → 22570 [ACK] Seq=80538 Ack=131074 Win=8192 Len=1000
  460 0.028851214 169.254.145.9 → 169.254.144.9 TCP 1040 [TCP Window Full] 7991 → 22570 [ACK] Seq=81538 Ack=131074 Win=8192 Len=1000
  461 0.029314566 169.254.144.9 → 169.254.145.9 TCP 40 22570 → 7991 [ACK] Seq=131074 Ack=76538 Win=7192 Len=0
  462 0.029336837 169.254.144.9 → 169.254.145.9 TCP 40 22570 → 7991 [ACK] Seq=131074 Ack=77538 Win=6192 Len=0
  463 0.029758286 169.254.145.9 → 169.254.144.9 TCP 1040 7991 → 22570 [ACK] Seq=82538 Ack=131074 Win=8192 Len=1000
  464 0.029770579 169.254.145.9 → 169.254.144.9 TCP 232 [TCP Window Full] 7991 → 22570 [ACK] Seq=83538 Ack=131074 Win=8192 Len=192
  465 0.030110712 169.254.144.9 → 169.254.145.9 TCP 40 22570 → 7991 [ACK] Seq=131074 Ack=78538 Win=7192 Len=0
  466 0.030139265 169.254.144.9 → 169.254.145.9 TCP 40 22570 → 7991 [ACK] Seq=131074 Ack=79538 Win=6192 Len=0
  467 0.030801060 169.254.145.9 → 169.254.144.9 TCP 1040 7991 → 22570 [ACK] Seq=83730 Ack=131074 Win=8192 Len=1000
  468 0.030813413 169.254.145.9 → 169.254.144.9 TCP 1040 [TCP Window Full] 7991 → 22570 [ACK] Seq=84730 Ack=131074 Win=8192 Len=1000
  469 0.031105627 169.254.144.9 → 169.254.145.9 TCP 40 22570 → 7991 [ACK] Seq=131074 Ack=80538 Win=7192 Len=0
  470 0.031141543 169.254.144.9 → 169.254.145.9 TCP 40 22570 → 7991 [ACK] Seq=131074 Ack=81538 Win=6192 Len=0
  471 0.031688746 169.254.145.9 → 169.254.144.9 TCP 1040 7991 → 22570 [ACK] Seq=85730 Ack=131074 Win=8192 Len=1000
  472 0.031700708 169.254.145.9 → 169.254.144.9 TCP 1040 [TCP Window Full] 7991 → 22570 [ACK] Seq=86730 Ack=131074 Win=8192 Len=1000
  473 0.032012618 169.254.144.9 → 169.254.145.9 TCP 40 22570 → 7991 [ACK] Seq=131074 Ack=82538 Win=7192 Len=0
  474 0.032035751 169.254.144.9 → 169.254.145.9 TCP 40 22570 → 7991 [ACK] Seq=131074 Ack=83538 Win=6192 Len=0
  475 0.032174817 169.254.145.9 → 169.254.144.9 TCP 1040 7991 → 22570 [ACK] Seq=87730 Ack=131074 Win=8192 Len=1000
  476 0.032180197 169.254.145.9 → 169.254.144.9 TCP 1040 [TCP Window Full] 7991 → 22570 [ACK] Seq=88730 Ack=131074 Win=8192 Len=1000
  477 0.032865890 169.254.144.9 → 169.254.145.9 TCP 40 22570 → 7991 [ACK] Seq=131074 Ack=83730 Win=8000 Len=0
  478 0.032923547 169.254.144.9 → 169.254.145.9 TCP 40 22570 → 7991 [ACK] Seq=131074 Ack=84730 Win=7000 Len=0
  479 0.033163229 169.254.145.9 → 169.254.144.9 TCP 1040 7991 → 22570 [ACK] Seq=89730 Ack=131074 Win=8192 Len=1000
  480 0.033169541 169.254.145.9 → 169.254.144.9 TCP 1040 [TCP Window Full] 7991 → 22570 [ACK] Seq=90730 Ack=131074 Win=8192 Len=1000
  481 0.033734020 169.254.144.9 → 169.254.145.9 TCP 40 22570 → 7991 [ACK] Seq=131074 Ack=85730 Win=7192 Len=0
  482 0.033780757 169.254.144.9 → 169.254.145.9 TCP 40 22570 → 7991 [ACK] Seq=131074 Ack=86730 Win=6192 Len=0
  483 0.034276473 169.254.145.9 → 169.254.144.9 TCP 1040 7991 → 22570 [ACK] Seq=91730 Ack=131074 Win=8192 Len=1000
  484 0.034292463 169.254.145.9 → 169.254.144.9 TCP 232 [TCP Window Full] 7991 → 22570 [ACK] Seq=92730 Ack=131074 Win=8192 Len=192
  485 0.034729185 169.254.144.9 → 169.254.145.9 TCP 40 22570 → 7991 [ACK] Seq=131074 Ack=87730 Win=7192 Len=0
  486 0.034762226 169.254.144.9 → 169.254.145.9 TCP 40 22570 → 7991 [ACK] Seq=131074 Ack=88730 Win=6192 Len=0
  487 0.035315369 169.254.145.9 → 169.254.144.9 TCP 1040 7991 → 22570 [ACK] Seq=92922 Ack=131074 Win=8192 Len=1000
  488 0.035343301 169.254.145.9 → 169.254.144.9 TCP 1040 [TCP Window Full] 7991 → 22570 [ACK] Seq=93922 Ack=131074 Win=8192 Len=1000
  489 0.035507338 169.254.144.9 → 169.254.145.9 TCP 40 22570 → 7991 [ACK] Seq=131074 Ack=89730 Win=7192 Len=0
  490 0.035524580 169.254.144.9 → 169.254.145.9 TCP 40 22570 → 7991 [ACK] Seq=131074 Ack=90730 Win=6192 Len=0
  491 0.035951038 169.254.145.9 → 169.254.144.9 TCP 1040 7991 → 22570 [ACK] Seq=94922 Ack=131074 Win=8192 Len=1000
  492 0.035964603 169.254.145.9 → 169.254.144.9 TCP 1040 [TCP Window Full] 7991 → 22570 [ACK] Seq=95922 Ack=131074 Win=8192 Len=1000
  493 0.036154869 169.254.144.9 → 169.254.145.9 TCP 40 22570 → 7991 [ACK] Seq=131074 Ack=91730 Win=7192 Len=0
  494 0.036168935 169.254.144.9 → 169.254.145.9 TCP 40 22570 → 7991 [ACK] Seq=131074 Ack=92730 Win=6192 Len=0
  495 0.036623425 169.254.145.9 → 169.254.144.9 TCP 1040 7991 → 22570 [ACK] Seq=96922 Ack=131074 Win=8192 Len=1000
  496 0.036637491 169.254.145.9 → 169.254.144.9 TCP 1040 [TCP Window Full] 7991 → 22570 [ACK] Seq=97922 Ack=131074 Win=8192 Len=1000
  497 0.036700390 169.254.144.9 → 169.254.145.9 TCP 40 22570 → 7991 [ACK] Seq=131074 Ack=92922 Win=8000 Len=0
  498 0.036714717 169.254.144.9 → 169.254.145.9 TCP 40 22570 → 7991 [ACK] Seq=131074 Ack=93922 Win=7000 Len=0
  499 0.037086874 169.254.145.9 → 169.254.144.9 TCP 1040 7991 → 22570 [ACK] Seq=98922 Ack=131074 Win=8192 Len=1000
  500 0.037100359 169.254.145.9 → 169.254.144.9 TCP 1040 [TCP Window Full] 7991 → 22570 [ACK] Seq=99922 Ack=131074 Win=8192 Len=1000
  501 0.037439671 169.254.144.9 → 169.254.145.9 TCP 40 22570 → 7991 [ACK] Seq=131074 Ack=94922 Win=7192 Len=0
  502 0.037457283 169.254.144.9 → 169.254.145.9 TCP 40 22570 → 7991 [ACK] Seq=131074 Ack=95922 Win=6192 Len=0
  503 0.037701443 169.254.145.9 → 169.254.144.9 TCP 1040 7991 → 22570 [ACK] Seq=100922 Ack=131074 Win=8192 Len=1000
  504 0.037708236 169.254.145.9 → 169.254.144.9 TCP 232 [TCP Window Full] 7991 → 22570 [ACK] Seq=101922 Ack=131074 Win=8192 Len=192
  505 0.037894394 169.254.144.9 → 169.254.145.9 TCP 40 22570 → 7991 [ACK] Seq=131074 Ack=96922 Win=7192 Len=0
  506 0.037904052 169.254.144.9 → 169.254.145.9 TCP 40 22570 → 7991 [ACK] Seq=131074 Ack=97922 Win=6192 Len=0
  507 0.037980260 169.254.145.9 → 169.254.144.9 TCP 1040 7991 → 22570 [ACK] Seq=102114 Ack=131074 Win=8192 Len=1000
  508 0.037985250 169.254.145.9 → 169.254.144.9 TCP 1040 [TCP Window Full] 7991 → 22570 [ACK] Seq=103114 Ack=131074 Win=8192 Len=1000
  509 0.038066433 169.254.144.9 → 169.254.145.9 TCP 40 22570 → 7991 [ACK] Seq=131074 Ack=98922 Win=7192 Len=0
  510 0.038071983 169.254.144.9 → 169.254.145.9 TCP 40 22570 → 7991 [ACK] Seq=131074 Ack=99922 Win=6192 Len=0
  511 0.038130369 169.254.145.9 → 169.254.144.9 TCP 1040 7991 → 22570 [ACK] Seq=104114 Ack=131074 Win=8192 Len=1000
  512 0.038136520 169.254.145.9 → 169.254.144.9 TCP 1040 [TCP Window Full] 7991 → 22570 [ACK] Seq=105114 Ack=131074 Win=8192 Len=1000
  513 0.038196654 169.254.144.9 → 169.254.145.9 TCP 40 22570 → 7991 [ACK] Seq=131074 Ack=100922 Win=7192 Len=0
  514 0.038201554 169.254.144.9 → 169.254.145.9 TCP 40 22570 → 7991 [ACK] Seq=131074 Ack=101922 Win=6192 Len=0
  515 0.038259689 169.254.145.9 → 169.254.144.9 TCP 1040 7991 → 22570 [ACK] Seq=106114 Ack=131074 Win=8192 Len=1000
  516 0.038265189 169.254.145.9 → 169.254.144.9 TCP 1040 [TCP Window Full] 7991 → 22570 [ACK] Seq=107114 Ack=131074 Win=8192 Len=1000
  517 0.038339399 169.254.144.9 → 169.254.145.9 TCP 40 22570 → 7991 [ACK] Seq=131074 Ack=102114 Win=8000 Len=0
  518 0.038345591 169.254.144.9 → 169.254.145.9 TCP 40 22570 → 7991 [ACK] Seq=131074 Ack=103114 Win=7000 Len=0
  519 0.038680719 169.254.145.9 → 169.254.144.9 TCP 1040 7991 → 22570 [ACK] Seq=108114 Ack=131074 Win=8192 Len=1000
  520 0.038687562 169.254.145.9 → 169.254.144.9 TCP 1040 [TCP Window Full] 7991 → 22570 [ACK] Seq=109114 Ack=131074 Win=8192 Len=1000
  521 0.039104468 169.254.144.9 → 169.254.145.9 TCP 40 22570 → 7991 [ACK] Seq=131074 Ack=104114 Win=7192 Len=0
  522 0.039124445 169.254.144.9 → 169.254.145.9 TCP 40 22570 → 7991 [ACK] Seq=131074 Ack=105114 Win=6192 Len=0
  523 0.039243152 169.254.145.9 → 169.254.144.9 TCP 1040 7991 → 22570 [ACK] Seq=110114 Ack=131074 Win=8192 Len=1000
  524 0.039262969 169.254.145.9 → 169.254.144.9 TCP 232 [TCP Window Full] 7991 → 22570 [ACK] Seq=111114 Ack=131074 Win=8192 Len=192
  525 0.039496084 169.254.144.9 → 169.254.145.9 TCP 40 22570 → 7991 [ACK] Seq=131074 Ack=106114 Win=7192 Len=0
  526 0.039509058 169.254.144.9 → 169.254.145.9 TCP 40 22570 → 7991 [ACK] Seq=131074 Ack=107114 Win=6192 Len=0
  527 0.039674522 169.254.145.9 → 169.254.144.9 TCP 1040 7991 → 22570 [ACK] Seq=111306 Ack=131074 Win=8192 Len=1000
  528 0.039681014 169.254.145.9 → 169.254.144.9 TCP 1040 [TCP Window Full] 7991 → 22570 [ACK] Seq=112306 Ack=131074 Win=8192 Len=1000
  529 0.039804786 169.254.144.9 → 169.254.145.9 TCP 40 22570 → 7991 [ACK] Seq=131074 Ack=108114 Win=7192 Len=0
  530 0.039811919 169.254.144.9 → 169.254.145.9 TCP 40 22570 → 7991 [ACK] Seq=131074 Ack=109114 Win=6192 Len=0
  531 0.039883670 169.254.145.9 → 169.254.144.9 TCP 1040 7991 → 22570 [ACK] Seq=113306 Ack=131074 Win=8192 Len=1000
  532 0.039889280 169.254.145.9 → 169.254.144.9 TCP 1040 [TCP Window Full] 7991 → 22570 [ACK] Seq=114306 Ack=131074 Win=8192 Len=1000
  533 0.039964903 169.254.144.9 → 169.254.145.9 TCP 40 22570 → 7991 [ACK] Seq=131074 Ack=110114 Win=7192 Len=0
  534 0.040002089 169.254.145.9 → 169.254.144.9 TCP 1040 7991 → 22570 [ACK] Seq=115306 Ack=131074 Win=8192 Len=1000
  535 0.040006597 169.254.145.9 → 169.254.144.9 TCP 1040 [TCP Window Full] 7991 → 22570 [ACK] Seq=116306 Ack=131074 Win=8192 Len=1000
  536 0.040155346 169.254.144.9 → 169.254.145.9 TCP 40 22570 → 7991 [ACK] Seq=131074 Ack=111114 Win=6192 Len=0
  537 0.040440214 169.254.144.9 → 169.254.145.9 TCP 40 22570 → 7991 [ACK] Seq=131074 Ack=111306 Win=8000 Len=0
  538 0.040453549 169.254.144.9 → 169.254.145.9 TCP 40 22570 → 7991 [ACK] Seq=131074 Ack=112306 Win=7000 Len=0
  539 0.040568389 169.254.145.9 → 169.254.144.9 TCP 1040 7991 → 22570 [ACK] Seq=117306 Ack=131074 Win=8192 Len=1000
  540 0.040574470 169.254.145.9 → 169.254.144.9 TCP 1040 [TCP Window Full] 7991 → 22570 [ACK] Seq=118306 Ack=131074 Win=8192 Len=1000
  541 0.040625327 169.254.144.9 → 169.254.145.9 TCP 40 22570 → 7991 [ACK] Seq=131074 Ack=113306 Win=7192 Len=0
  542 0.040631809 169.254.144.9 → 169.254.145.9 TCP 40 22570 → 7991 [ACK] Seq=131074 Ack=114306 Win=6192 Len=0
  543 0.040700294 169.254.145.9 → 169.254.144.9 TCP 1040 7991 → 22570 [ACK] Seq=119306 Ack=131074 Win=8192 Len=1000
  544 0.040706024 169.254.145.9 → 169.254.144.9 TCP 232 [TCP Window Full] 7991 → 22570 [ACK] Seq=120306 Ack=131074 Win=8192 Len=192
  545 0.040769605 169.254.144.9 → 169.254.145.9 TCP 40 22570 → 7991 [ACK] Seq=131074 Ack=115306 Win=7192 Len=0
  546 0.040776418 169.254.144.9 → 169.254.145.9 TCP 40 22570 → 7991 [ACK] Seq=131074 Ack=116306 Win=6192 Len=0
  547 0.040848378 169.254.145.9 → 169.254.144.9 TCP 1040 7991 → 22570 [ACK] Seq=120498 Ack=131074 Win=8192 Len=1000
  548 0.040854179 169.254.145.9 → 169.254.144.9 TCP 1040 [TCP Window Full] 7991 → 22570 [ACK] Seq=121498 Ack=131074 Win=8192 Len=1000
  549 0.040903413 169.254.144.9 → 169.254.145.9 TCP 40 22570 → 7991 [ACK] Seq=131074 Ack=117306 Win=7192 Len=0
  550 0.040909935 169.254.144.9 → 169.254.145.9 TCP 40 22570 → 7991 [ACK] Seq=131074 Ack=118306 Win=6192 Len=0
  551 0.040980583 169.254.145.9 → 169.254.144.9 TCP 1040 7991 → 22570 [ACK] Seq=122498 Ack=131074 Win=8192 Len=1000
  552 0.040986023 169.254.145.9 → 169.254.144.9 TCP 1040 [TCP Window Full] 7991 → 22570 [ACK] Seq=123498 Ack=131074 Win=8192 Len=1000
  553 0.041038744 169.254.144.9 → 169.254.145.9 TCP 40 22570 → 7991 [ACK] Seq=131074 Ack=119306 Win=7192 Len=0
  554 0.041044915 169.254.144.9 → 169.254.145.9 TCP 40 22570 → 7991 [ACK] Seq=131074 Ack=120306 Win=6192 Len=0
  555 0.041117718 169.254.145.9 → 169.254.144.9 TCP 1040 7991 → 22570 [ACK] Seq=124498 Ack=131074 Win=8192 Len=1000
  556 0.041123468 169.254.145.9 → 169.254.144.9 TCP 1040 [TCP Window Full] 7991 → 22570 [ACK] Seq=125498 Ack=131074 Win=8192 Len=1000
  557 0.041166711 169.254.144.9 → 169.254.145.9 TCP 40 22570 → 7991 [ACK] Seq=131074 Ack=120498 Win=8000 Len=0
  558 0.041172111 169.254.144.9 → 169.254.145.9 TCP 40 22570 → 7991 [ACK] Seq=131074 Ack=121498 Win=7000 Len=0
  559 0.041215319 169.254.145.9 → 169.254.144.9 TCP 1040 7991 → 22570 [ACK] Seq=126498 Ack=131074 Win=8192 Len=1000
  560 0.041220007 169.254.145.9 → 169.254.144.9 TCP 1040 [TCP Window Full] 7991 → 22570 [ACK] Seq=127498 Ack=131074 Win=8192 Len=1000
  561 0.041266887 169.254.144.9 → 169.254.145.9 TCP 40 22570 → 7991 [ACK] Seq=131074 Ack=122498 Win=7192 Len=0
  562 0.041271986 169.254.144.9 → 169.254.145.9 TCP 40 22570 → 7991 [ACK] Seq=131074 Ack=123498 Win=6192 Len=0
  563 0.041317157 169.254.145.9 → 169.254.144.9 TCP 1040 7991 → 22570 [ACK] Seq=128498 Ack=131074 Win=8192 Len=1000
  564 0.041321475 169.254.145.9 → 169.254.144.9 TCP 232 [TCP Window Full] 7991 → 22570 [ACK] Seq=129498 Ack=131074 Win=8192 Len=192
  565 0.041368075 169.254.144.9 → 169.254.145.9 TCP 40 22570 → 7991 [ACK] Seq=131074 Ack=124498 Win=7192 Len=0
  566 0.041400555 169.254.144.9 → 169.254.145.9 TCP 40 22570 → 7991 [ACK] Seq=131074 Ack=125498 Win=6192 Len=0
  567 0.041588531 169.254.145.9 → 169.254.144.9 TCP 1040 7991 → 22570 [ACK] Seq=129690 Ack=131074 Win=8192 Len=1000
  568 0.041594742 169.254.145.9 → 169.254.144.9 TCP 423 7991 → 22570 [FIN, ACK] Seq=130690 Ack=131074 Win=8192 Len=383
  569 0.041767255 169.254.144.9 → 169.254.145.9 TCP 40 22570 → 7991 [ACK] Seq=131074 Ack=126498 Win=7192 Len=0
  570 0.041777273 169.254.144.9 → 169.254.145.9 TCP 40 22570 → 7991 [ACK] Seq=131074 Ack=127498 Win=6192 Len=0
  571 0.041977274 169.254.144.9 → 169.254.145.9 TCP 40 22570 → 7991 [ACK] Seq=131074 Ack=128498 Win=7192 Len=0
  572 0.041985459 169.254.144.9 → 169.254.145.9 TCP 40 22570 → 7991 [ACK] Seq=131074 Ack=129498 Win=6192 Len=0
  573 0.042181052 169.254.144.9 → 169.254.145.9 TCP 40 22570 → 7991 [ACK] Seq=131074 Ack=129690 Win=8000 Len=0
  574 0.042192363 169.254.144.9 → 169.254.145.9 TCP 40 22570 → 7991 [ACK] Seq=131074 Ack=130690 Win=7000 Len=0
  575 0.042881200 169.254.144.9 → 169.254.145.9 TCP 40 22570 → 7991 [ACK] Seq=131074 Ack=131074 Win=7809 Len=0